Project_optimizing_U-net/unet_keras_gpu.log.tmp
{"input": ["cuda -keys=cuda,gpu -max_num_threads=1024 -model=unknown -thread_warp_size=32", "conv2d_nchw_winograd.cuda", [["TENSOR", [1, 3, 256, 256], "float32"], ["TENSOR", [64, 3, 3, 3], "float32"], [1, 1], [1, 1, 1, 1], [1, 1], "float32"], {}], "config": {"index": 169357, "code_hash": null, "entity": [["tile_b", "sp", [-1, 1, 1, 1]], ["tile_y", "sp", [-1, 1, 4, 1]], ["tile_x", "sp", [-1, 64, 4, 4]], ["tile_rc", "sp", [-1, 1]], ["auto_unroll_max_step", "ot", 1500], ["unroll_explicit", "ot", 0]]}, "result": [[0.0001686160545073375], 0, 4.7060534954071045, 1623583375.5894306], "version": 0.2, "tvm_version": "0.8.dev0"}
{"input": ["cuda -keys=cuda,gpu -max_num_threads=1024 -model=unknown -thread_warp_size=32", "conv2d_nchw_winograd.cuda", [["TENSOR", [1, 3, 256, 256], "float32"], ["TENSOR", [64, 3, 3, 3], "float32"], [1, 1], [1, 1, 1, 1], [1, 1], "float32"], {}], "config": {"index": 143823, "code_hash": null, "entity": [["tile_b", "sp", [-1, 1, 1, 1]], ["tile_y", "sp", [-1, 4, 4, 1]], ["tile_x", "sp", [-1, 16, 2, 32]], ["tile_rc", "sp", [-1, 3]], ["auto_unroll_max_step", "ot", 128], ["unroll_explicit", "ot", 0]]}, "result": [[0.0017630120364963502], 0, 3.915663003921509, 1623583377.380245], "version": 0.2, "tvm_version": "0.8.dev0"}
{"input": ["cuda -keys=cuda,gpu -max_num_threads=1024 -model=unknown -thread_warp_size=32", "conv2d_nchw_winograd.cuda", [["TENSOR", [1, 3, 256, 256], "float32"], ["TENSOR", [64, 3, 3, 3], "float32"], [1, 1], [1, 1, 1, 1], [1, 1], "float32"], {}], "config": {"index": 364098, "code_hash": null, "entity": [["tile_b", "sp", [-1, 1, 1, 1]], ["tile_y", "sp", [-1, 8, 4, 2]], ["tile_x", "sp", [-1, 16, 1, 8]], ["tile_rc", "sp", [-1, 3]], ["auto_unroll_max_step", "ot", 128], ["unroll_explicit", "ot", 1]]}, "result": [[0.0022611459253731345], 0, 4.400658845901489, 1623583378.6848285], "version": 0.2, "tvm_version": "0.8.dev0"}
{"input": ["cuda -keys=cuda,gpu -max_num_threads=1024 -model=unknown -thread_warp_size=32", "conv2d_nchw_winograd.cuda", [["TENSOR", [1, 3, 256, 256], "float32"], ["TENSOR", [64, 3, 3, 3], "float32"], [1, 1], [1, 1, 1, 1], [1, 1], "float32"], {}], "config": {"index": 28291, "code_hash": null, "entity": [["tile_b", "sp", [-1, 1, 1, 1]], ["tile_y", "sp", [-1, 8, 1, 8]], ["tile_x", "sp", [-1, 2, 1, 32]], ["tile_rc", "sp", [-1, 1]], ["auto_unroll_max_step", "ot", 0], ["unroll_explicit", "ot", 0]]}, "result": [[0.006939164124999999], 0, 4.237977981567383, 1623583380.2277346], "version": 0.2, "tvm_version": "0.8.dev0"}
{"input": ["cuda -keys=cuda,gpu -max_num_threads=1024 -model=unknown -thread_warp_size=32", "conv2d_nchw_winograd.cuda", [["TENSOR", [1, 3, 256, 256], "float32"], ["TENSOR", [64, 3, 3, 3], "float32"], [1, 1], [1, 1, 1, 1], [1, 1], "float32"], {}], "config": {"index": 156730, "code_hash": null, "entity": [["tile_b", "sp", [-1, 1, 1, 1]], ["tile_y", "sp", [-1, 4, 2, 8]], ["tile_x", "sp", [-1, 512, 8, 1]], ["tile_rc", "sp", [-1, 1]], ["auto_unroll_max_step", "ot", 1500], ["unroll_explicit", "ot", 0]]}, "result": [[0.004437884088235294], 0, 4.041696071624756, 1623583381.6598485], "version": 0.2, "tvm_version": "0.8.dev0"}
{"input": ["cuda -keys=cuda,gpu -max_num_threads=1024 -model=unknown -thread_warp_size=32", "conv2d_nchw_winograd.cuda", [["TENSOR", [1, 3, 256, 256], "float32"], ["TENSOR", [64, 3, 3, 3], "float32"], [1, 1], [1, 1, 1, 1], [1, 1], "float32"], {}], "config": {"index": 390043, "code_hash": null, "entity": [["tile_b", "sp", [-1, 1, 1, 1]], ["tile_y", "sp", [-1, 8, 1, 2]], ["tile_x", "sp", [-1, 4, 1, 2]], ["tile_rc", "sp", [-1, 1]], ["auto_unroll_max_step", "ot", 1500], ["unroll_explicit", "ot", 1]]}, "result": [[0.00025341588364779876], 0, 4.054322242736816, 1623583384.1261487], "version": 0.2, "tvm_version": "0.8.dev0"}
{"input": ["cuda -keys=cuda,gpu -max_num_threads=1024 -model=unknown -thread_warp_size=32", "conv2d_nchw_winograd.cuda", [["TENSOR", [1, 3, 256, 256], "float32"], ["TENSOR", [64, 3, 3, 3], "float32"], [1, 1], [1, 1, 1, 1], [1, 1], "float32"], {}], "config": {"index": 48784, "code_hash": null, "entity": [["tile_b", "sp", [-1, 1, 1, 1]], ["tile_y", "sp", [-1, 1, 1, 8]], ["tile_x", "sp", [-1, 2, 8, 2]], ["tile_rc", "sp", [-1, 3]], ["auto_unroll_max_step", "ot", 0], ["unroll_explicit", "ot", 0]]}, "result": [[8.619809690060563e-05], 0, 3.5765318870544434, 1623583385.739909], "version": 0.2, "tvm_version": "0.8.dev0"}
{"input": ["cuda -keys=cuda,gpu -max_num_threads=1024 -model=unknown -thread_warp_size=32", "conv2d_nchw_winograd.cuda", [["TENSOR", [1, 3, 256, 256], "float32"], ["TENSOR", [64, 3, 3, 3], "float32"], [1, 1], [1, 1, 1, 1], [1, 1], "float32"], {}], "config": {"index": 176626, "code_hash": null, "entity": [["tile_b", "sp", [-1, 1, 1, 1]], ["tile_y", "sp", [-1, 1, 4, 4]], ["tile_x", "sp", [-1, 4, 64, 8]], ["tile_rc", "sp", [-1, 1]], ["auto_unroll_max_step", "ot", 1500], ["unroll_explicit", "ot", 0]]}, "result": [[0.00023246261553211888], 0, 3.9496803283691406, 1623583387.3122187], "version": 0.2, "tvm_version": "0.8.dev0"}
{"input": ["cuda -keys=cuda,gpu -max_num_threads=1024 -model=unknown -thread_warp_size=32", "conv2d_nchw_winograd.cuda", [["TENSOR", [1, 3, 256, 256], "float32"], ["TENSOR", [64, 3, 3, 3], "float32"], [1, 1], [1, 1, 1, 1], [1, 1], "float32"], {}], "config": {"index": 341922, "code_hash": null, "entity": [["tile_b", "sp", [-1, 1, 1, 1]], ["tile_y", "sp", [-1, 8, 4, 2]], ["tile_x", "sp", [-1, 2, 4, 256]], ["tile_rc", "sp", [-1, 1]], ["auto_unroll_max_step", "ot", 128], ["unroll_explicit", "ot", 1]]}, "result": [[0.00304716602], 0, 3.4285290241241455, 1623583388.5401373], "version": 0.2, "tvm_version": "0.8.dev0"}
{"input": ["cuda -keys=cuda,gpu -max_num_threads=1024 -model=unknown -thread_warp_size=32", "conv2d_nchw_winograd.cuda", [["TENSOR", [1, 3, 256, 256], "float32"], ["TENSOR", [64, 3, 3, 3], "float32"], [1, 1], [1, 1, 1, 1], [1, 1], "float32"], {}], "config": {"index": 248317, "code_hash": null, "entity": [["tile_b", "sp", [-1, 1, 1, 1]], ["tile_y", "sp", [-1, 1, 4, 1]], ["tile_x", "sp", [-1, 2, 128, 4]], ["tile_rc", "sp", [-1, 1]], ["auto_unroll_max_step", "ot", 0], ["unroll_explicit", "ot", 1]]}, "result": [[0.00011359607855127001], 0, 3.6671764850616455, 1623583390.1965227], "version": 0.2, "tvm_version": "0.8.dev0"}
{"input": ["cuda -keys=cuda,gpu -max_num_threads=1024 -model=unknown -thread_warp_size=32", "conv2d_nchw_winograd.cuda", [["TENSOR", [1, 3, 256, 256], "float32"], ["TENSOR", [64, 3, 3, 3], "float32"], [1, 1], [1, 1, 1, 1], [1, 1], "float32"], {}], "config": {"index": 424314, "code_hash": null, "entity": [["tile_b", "sp", [-1, 1, 1, 1]], ["tile_y", "sp", [-1, 4, 1, 2]], ["tile_x", "sp", [-1, 1, 16, 1]], ["tile_rc", "sp", [-1, 3]], ["auto_unroll_max_step", "ot", 1500], ["unroll_explicit", "ot", 1]]}, "result": [[0.00011055304997707472], 0, 3.515275239944458, 1623583391.7339845], "version": 0.2, "tvm_version": "0.8.dev0"}
{"input": ["cuda -keys=cuda,gpu -max_num_threads=1024 -model=unknown -thread_warp_size=32", "conv2d_nchw_winograd.cuda", [["TENSOR", [1, 3, 256, 256], "float32"], ["TENSOR", [64, 3, 3, 3], "float32"], [1, 1], [1, 1, 1, 1], [1, 1], "float32"], {}], "config": {"index": 116638, "code_hash": null, "entity": [["tile_b", "sp", [-1, 1, 1, 1]], ["tile_y", "sp", [-1, 1, 16, 2]], ["tile_x", "sp", [-1, 1024, 2, 1]], ["tile_rc", "sp", [-1, 3]], ["auto_unroll_max_step", "ot", 128], ["unroll_explicit", "ot", 0]]}, "result": [[0.0006031652144638404], 0, 3.5179443359375, 1623583398.868173], "version": 0.2, "tvm_version": "0.8.dev0"}
{"input": ["cuda -keys=cuda,gpu -max_num_threads=1024 -model=unknown -thread_warp_size=32", "conv2d_nchw_winograd.cuda", [["TENSOR", [1, 3, 256, 256], "float32"], ["TENSOR", [64, 3, 3, 3], "float32"], [1, 1], [1, 1, 1, 1], [1, 1], "float32"], {}], "config": {"index": 386130, "code_hash": null, "entity": [["tile_b", "sp", [-1, 1, 1, 1]], ["tile_y", "sp", [-1, 4, 1, 8]], ["tile_x", "sp", [-1, 1, 16, 1]], ["tile_rc", "sp", [-1, 1]], ["auto_unroll_max_step", "ot", 1500], ["unroll_explicit", "ot", 1]]}, "result": [[8.02400203740815e-05], 0, 3.245218276977539, 1623583400.3904045], "version": 0.2, "tvm_version": "0.8.dev0"}
{"input": ["cuda -keys=cuda,gpu -max_num_threads=1024 -model=unknown -thread_warp_size=32", "conv2d_nchw_winograd.cuda", [["TENSOR", [1, 3, 256, 256], "float32"], ["TENSOR", [64, 3, 3, 3], "float32"], [1, 1], [1, 1, 1, 1], [1, 1], "float32"], {}], "config": {"index": 244933, "code_hash": null, "entity": [["tile_b", "sp", [-1, 1, 1, 1]], ["tile_y", "sp", [-1, 1, 8, 8]], ["tile_x", "sp", [-1, 32, 2, 4]], ["tile_rc", "sp", [-1, 1]], ["auto_unroll_max_step", "ot", 0], ["unroll_explicit", "ot", 1]]}, "result": [[0.00038808202773246334], 0, 3.8590264320373535, 1623583402.2309244], "version": 0.2, "tvm_version": "0.8.dev0"}
{"input": ["cuda -keys=cuda,gpu -max_num_threads=1024 -model=unknown -thread_warp_size=32", "conv2d_nchw_winograd.cuda", [["TENSOR", [1, 3, 256, 256], "float32"], ["TENSOR", [64, 3, 3, 3], "float32"], [1, 1], [1, 1, 1, 1], [1, 1], "float32"], {}], "config": {"index": 156567, "code_hash": null, "entity": [["tile_b", "sp", [-1, 1, 1, 1]], ["tile_y", "sp", [-1, 2, 1, 16]], ["tile_x", "sp", [-1, 128, 8, 1]], ["tile_rc", "sp", [-1, 1]], ["auto_unroll_max_step", "ot", 1500], ["unroll_explicit", "ot", 0]]}, "result": [[0.001017359195945946], 0, 3.9760448932647705, 1623583403.5103912], "version": 0.2, "tvm_version": "0.8.dev0"}
{"input": ["cuda -keys=cuda,gpu -max_num_threads=1024 -model=unknown -thread_warp_size=32", "conv2d_nchw_winograd.cuda", [["TENSOR", [1, 3, 256, 256], "float32"], ["TENSOR", [64, 3, 3, 3], "float32"], [1, 1], [1, 1, 1, 1], [1, 1], "float32"], {}], "config": {"index": 292786, "code_hash": null, "entity": [["tile_b", "sp", [-1, 1, 1, 1]], ["tile_y", "sp", [-1, 1, 16, 2]], ["tile_x", "sp", [-1, 2, 2, 16]], ["tile_rc", "sp", [-1, 3]], ["auto_unroll_max_step", "ot", 0], ["unroll_explicit", "ot", 1]]}, "result": [[0.00024362554444444444], 0, 3.488494873046875, 1623583405.1358645], "version": 0.2, "tvm_version": "0.8.dev0"}
{"input": ["cuda -keys=cuda,gpu -max_num_threads=1024 -model=unknown -thread_warp_size=32", "conv2d_nchw_winograd.cuda", [["TENSOR", [1, 3, 256, 256], "float32"], ["TENSOR", [64, 3, 3, 3], "float32"], [1, 1], [1, 1, 1, 1], [1, 1], "float32"], {}], "config": {"index": 168659, "code_hash": null, "entity": [["tile_b", "sp", [-1, 1, 1, 1]], ["tile_y", "sp", [-1, 1, 4, 8]], ["tile_x", "sp", [-1, 128, 2, 4]], ["tile_rc", "sp", [-1, 1]], ["auto_unroll_max_step", "ot", 1500], ["unroll_explicit", "ot", 0]]}, "result": [[0.0011088571559633028], 0, 6.900495290756226, 1623583407.1372008], "version": 0.2, "tvm_version": "0.8.dev0"}
{"input": ["cuda -keys=cuda,gpu -max_num_threads=1024 -model=unknown -thread_warp_size=32", "conv2d_nchw_winograd.cuda", [["TENSOR", [1, 3, 256, 256], "float32"], ["TENSOR", [64, 3, 3, 3], "float32"], [1, 1], [1, 1, 1, 1], [1, 1], "float32"], {}], "config": {"index": 404888, "code_hash": null, "entity": [["tile_b", "sp", [-1, 1, 1, 1]], ["tile_y", "sp", [-1, 2, 2, 1]], ["tile_x", "sp", [-1, 2, 16, 8]], ["tile_rc", "sp", [-1, 1]], ["auto_unroll_max_step", "ot", 1500], ["unroll_explicit", "ot", 1]]}, "result": [[0.00019184063546798033], 0, 3.364912509918213, 1623583408.6322446], "version": 0.2, "tvm_version": "0.8.dev0"}
{"input": ["cuda -keys=cuda,gpu -max_num_threads=1024 -model=unknown -thread_warp_size=32", "conv2d_nchw_winograd.cuda", [["TENSOR", [1, 3, 256, 256], "float32"], ["TENSOR", [64, 3, 3, 3], "float32"], [1, 1], [1, 1, 1, 1], [1, 1], "float32"], {}], "config": {"index": 363830, "code_hash": null, "entity": [["tile_b", "sp", [-1, 1, 1, 1]], ["tile_y", "sp", [-1, 2, 32, 1]], ["tile_x", "sp", [-1, 2, 1, 8]], ["tile_rc", "sp", [-1, 3]], ["auto_unroll_max_step", "ot", 128], ["unroll_explicit", "ot", 1]]}, "result": [[0.00030371802226720644], 0, 2.935563802719116, 1623583409.7247], "version": 0.2, "tvm_version": "0.8.dev0"}
{"input": ["cuda -keys=cuda,gpu -max_num_threads=1024 -model=unknown -thread_warp_size=32", "conv2d_nchw_winograd.cuda", [["TENSOR", [1, 3, 256, 256], "float32"], ["TENSOR", [64, 3, 3, 3], "float32"], [1, 1], [1, 1, 1, 1], [1, 1], "float32"], {}], "config": {"index": 394753, "code_hash": null, "entity": [["tile_b", "sp", [-1, 1, 1, 1]], ["tile_y", "sp", [-1, 8, 2, 2]], ["tile_x", "sp", [-1, 2, 64, 2]], ["tile_rc", "sp", [-1, 1]], ["auto_unroll_max_step", "ot", 1500], ["unroll_explicit", "ot", 1]]}, "result": [[8.781089348462665e-05], 0, 3.818509340286255, 1623583411.2213764], "version": 0.2, "tvm_version": "0.8.dev0"}
{"input": ["cuda -keys=cuda,gpu -max_num_threads=1024 -model=unknown -thread_warp_size=32", "conv2d_nchw_winograd.cuda", [["TENSOR", [1, 3, 256, 256], "float32"], ["TENSOR", [64, 3, 3, 3], "float32"], [1, 1], [1, 1, 1, 1], [1, 1], "float32"], {}], "config": {"index": 163595, "code_hash": null, "entity": [["tile_b", "sp", [-1, 1, 1, 1]], ["tile_y", "sp", [-1, 2, 16, 2]], ["tile_x", "sp", [-1, 8, 8, 2]], ["tile_rc", "sp", [-1, 1]], ["auto_unroll_max_step", "ot", 1500], ["unroll_explicit", "ot", 0]]}, "result": [[9.490454406580494e-05], 0, 3.6611053943634033, 1623583412.7341971], "version": 0.2, "tvm_version": "0.8.dev0"}
{"input": ["cuda -keys=cuda,gpu -max_num_threads=1024 -model=unknown -thread_warp_size=32", "conv2d_nchw_winograd.cuda", [["TENSOR", [1, 3, 256, 256], "float32"], ["TENSOR", [64, 3, 3, 3], "float32"], [1, 1], [1, 1, 1, 1], [1, 1], "float32"], {}], "config": {"index": 316321, "code_hash": null, "entity": [["tile_b", "sp", [-1, 1, 1, 1]], ["tile_y", "sp", [-1, 1, 8, 4]], ["tile_x", "sp", [-1, 2, 8, 2]], ["tile_rc", "sp", [-1, 1]], ["auto_unroll_max_step", "ot", 128], ["unroll_explicit", "ot", 1]]}, "result": [[8.215852191780823e-05], 0, 3.5301849842071533, 1623583414.2203693], "version": 0.2, "tvm_version": "0.8.dev0"}
{"input": ["cuda -keys=cuda,gpu -max_num_threads=1024 -model=unknown -thread_warp_size=32", "conv2d_nchw_winograd.cuda", [["TENSOR", [1, 3, 256, 256], "float32"], ["TENSOR", [64, 3, 3, 3], "float32"], [1, 1], [1, 1, 1, 1], [1, 1], "float32"], {}], "config": {"index": 248308, "code_hash": null, "entity": [["tile_b", "sp", [-1, 1, 1, 1]], ["tile_y", "sp", [-1, 16, 1, 1]], ["tile_x", "sp", [-1, 2, 128, 4]], ["tile_rc", "sp", [-1, 1]], ["auto_unroll_max_step", "ot", 0], ["unroll_explicit", "ot", 1]]}, "result": [[0.00013507722775601565], 0, 3.358856201171875, 1623583415.8380787], "version": 0.2, "tvm_version": "0.8.dev0"}
{"input": ["cuda -keys=cuda,gpu -max_num_threads=1024 -model=unknown -thread_warp_size=32", "conv2d_nchw_winograd.cuda", [["TENSOR", [1, 3, 256, 256], "float32"], ["TENSOR", [64, 3, 3, 3], "float32"], [1, 1], [1, 1, 1, 1], [1, 1], "float32"], {}], "config": {"index": 394440, "code_hash": null, "entity": [["tile_b", "sp", [-1, 1, 1, 1]], ["tile_y", "sp", [-1, 4, 4, 4]], ["tile_x", "sp", [-1, 16, 32, 2]], ["tile_rc", "sp", [-1, 1]], ["auto_unroll_max_step", "ot", 1500], ["unroll_explicit", "ot", 1]]}, "result": [[0.00018415092056074767], 0, 4.836942434310913, 1623583417.4915648], "version": 0.2, "tvm_version": "0.8.dev0"}
{"input": ["cuda -keys=cuda,gpu -max_num_threads=1024 -model=unknown -thread_warp_size=32", "conv2d_nchw_winograd.cuda", [["TENSOR", [1, 3, 256, 256], "float32"], ["TENSOR", [64, 3, 3, 3], "float32"], [1, 1], [1, 1, 1, 1], [1, 1], "float32"], {}], "config": {"index": 444122, "code_hash": null, "entity": [["tile_b", "sp", [-1, 1, 1, 1]], ["tile_y", "sp", [-1, 2, 4, 1]], ["tile_x", "sp", [-1, 4, 64, 8]], ["tile_rc", "sp", [-1, 3]], ["auto_unroll_max_step", "ot", 1500], ["unroll_explicit", "ot", 1]]}, "result": [[0.00022258345898617512], 0, 3.6586952209472656, 1623583427.600137], "version": 0.2, "tvm_version": "0.8.dev0"}
{"input": ["cuda -keys=cuda,gpu -max_num_threads=1024 -model=unknown -thread_warp_size=32", "conv2d_nchw_winograd.cuda", [["TENSOR", [1, 3, 256, 256], "float32"], ["TENSOR", [64, 3, 3, 3], "float32"], [1, 1], [1, 1, 1, 1], [1, 1], "float32"], {}], "config": {"index": 130912, "code_hash": null, "entity": [["tile_b", "sp", [-1, 1, 1, 1]], ["tile_y", "sp", [-1, 2, 4, 2]], ["tile_x", "sp", [-1, 8, 4, 4]], ["tile_rc", "sp", [-1, 3]], ["auto_unroll_max_step", "ot", 128], ["unroll_explicit", "ot", 0]]}, "result": [[0.00014569191737032568], 0, 3.5043256282806396, 1623583429.1210315], "version": 0.2, "tvm_version": "0.8.dev0"}
{"input": ["cuda -keys=cuda,gpu -max_num_threads=1024 -model=unknown -thread_warp_size=32", "conv2d_nchw_winograd.cuda", [["TENSOR", [1, 3, 256, 256], "float32"], ["TENSOR", [64, 3, 3, 3], "float32"], [1, 1], [1, 1, 1, 1], [1, 1], "float32"], {}], "config": {"index": 282313, "code_hash": null, "entity": [["tile_b", "sp", [-1, 1, 1, 1]], ["tile_y", "sp", [-1, 1, 8, 8]], ["tile_x", "sp", [-1, 64, 1, 4]], ["tile_rc", "sp", [-1, 3]], ["auto_unroll_max_step", "ot", 0], ["unroll_explicit", "ot", 1]]}, "result": [[0.0011483393816793892], 0, 3.7818081378936768, 1623583430.4907274], "version": 0.2, "tvm_version": "0.8.dev0"}
{"input": ["cuda -keys=cuda,gpu -max_num_threads=1024 -model=unknown -thread_warp_size=32", "conv2d_nchw_winograd.cuda", [["TENSOR", [1, 3, 256, 256], "float32"], ["TENSOR", [64, 3, 3, 3], "float32"], [1, 1], [1, 1, 1, 1], [1, 1], "float32"], {}], "config": {"index": 49877, "code_hash": null, "entity": [["tile_b", "sp", [-1, 1, 1, 1]], ["tile_y", "sp", [-1, 2, 1, 8]], ["tile_x", "sp", [-1, 32, 16, 2]], ["tile_rc", "sp", [-1, 3]], ["auto_unroll_max_step", "ot", 0], ["unroll_explicit", "ot", 0]]}, "result": [[0.0005330408080357143], 0, 3.5985333919525146, 1623583432.0235345], "version": 0.2, "tvm_version": "0.8.dev0"}
{"input": ["cuda -keys=cuda,gpu -max_num_threads=1024 -model=unknown -thread_warp_size=32", "conv2d_nchw_winograd.cuda", [["TENSOR", [1, 3, 256, 256], "float32"], ["TENSOR", [64, 3, 3, 3], "float32"], [1, 1], [1, 1, 1, 1], [1, 1], "float32"], {}], "config": {"index": 425964, "code_hash": null, "entity": [["tile_b", "sp", [-1, 1, 1, 1]], ["tile_y", "sp", [-1, 1, 1, 1]], ["tile_x", "sp", [-1, 8, 64, 1]], ["tile_rc", "sp", [-1, 3]], ["auto_unroll_max_step", "ot", 1500], ["unroll_explicit", "ot", 1]]}, "result": [[9.164666389728096e-05], 0, 3.481451988220215, 1623583433.5143936], "version": 0.2, "tvm_version": "0.8.dev0"}
{"input": ["cuda -keys=cuda,gpu -max_num_threads=1024 -model=unknown -thread_warp_size=32", "conv2d_nchw_winograd.cuda", [["TENSOR", [1, 3, 256, 256], "float32"], ["TENSOR", [64, 3, 3, 3], "float32"], [1, 1], [1, 1, 1, 1], [1, 1], "float32"], {}], "config": {"index": 438577, "code_hash": null, "entity": [["tile_b", "sp", [-1, 1, 1, 1]], ["tile_y", "sp", [-1, 1, 4, 1]], ["tile_x", "sp", [-1, 4, 32, 4]], ["tile_rc", "sp", [-1, 3]], ["auto_unroll_max_step", "ot", 1500], ["unroll_explicit", "ot", 1]]}, "result": [[8.313733425319076e-05], 0, 3.466705322265625, 1623583435.742449], "version": 0.2, "tvm_version": "0.8.dev0"}
{"input": ["cuda -keys=cuda,gpu -max_num_threads=1024 -model=unknown -thread_warp_size=32", "conv2d_nchw_winograd.cuda", [["TENSOR", [1, 3, 256, 256], "float32"], ["TENSOR", [64, 3, 3, 3], "float32"], [1, 1], [1, 1, 1, 1], [1, 1], "float32"], {}], "config": {"index": 422937, "code_hash": null, "entity": [["tile_b", "sp", [-1, 1, 1, 1]], ["tile_y", "sp", [-1, 2, 1, 32]], ["tile_x", "sp", [-1, 16, 4, 1]], ["tile_rc", "sp", [-1, 3]], ["auto_unroll_max_step", "ot", 1500], ["unroll_explicit", "ot", 1]]}, "result": [[0.0015074548375], 0, 10.09989595413208, 1623583437.84603], "version": 0.2, "tvm_version": "0.8.dev0"}
{"input": ["cuda -keys=cuda,gpu -max_num_threads=1024 -model=unknown -thread_warp_size=32", "conv2d_nchw_winograd.cuda", [["TENSOR", [1, 3, 256, 256], "float32"], ["TENSOR", [64, 3, 3, 3], "float32"], [1, 1], [1, 1, 1, 1], [1, 1], "float32"], {}], "config": {"index": 35799, "code_hash": null, "entity": [["tile_b", "sp", [-1, 1, 1, 1]], ["tile_y", "sp", [-1, 4, 4, 1]], ["tile_x", "sp", [-1, 2, 2, 256]], ["tile_rc", "sp", [-1, 1]], ["auto_unroll_max_step", "ot", 0], ["unroll_explicit", "ot", 0]]}, "result": [[0.0009016525485074627], 0, 3.51692795753479, 1623583439.684704], "version": 0.2, "tvm_version": "0.8.dev0"}
{"input": ["cuda -keys=cuda,gpu -max_num_threads=1024 -model=unknown -thread_warp_size=32", "conv2d_nchw_winograd.cuda", [["TENSOR", [1, 3, 256, 256], "float32"], ["TENSOR", [64, 3, 3, 3], "float32"], [1, 1], [1, 1, 1, 1], [1, 1], "float32"], {}], "config": {"index": 171539, "code_hash": null, "entity": [["tile_b", "sp", [-1, 1, 1, 1]], ["tile_y", "sp", [-1, 16, 2, 1]], ["tile_x", "sp", [-1, 4, 64, 4]], ["tile_rc", "sp", [-1, 1]], ["auto_unroll_max_step", "ot", 1500], ["unroll_explicit", "ot", 0]]}, "result": [[0.00016246114266487213], 0, 3.989973306655884, 1623583441.2836199], "version": 0.2, "tvm_version": "0.8.dev0"}
{"input": ["cuda -keys=cuda,gpu -max_num_threads=1024 -model=unknown -thread_warp_size=32", "conv2d_nchw_winograd.cuda", [["TENSOR", [1, 3, 256, 256], "float32"], ["TENSOR", [64, 3, 3, 3], "float32"], [1, 1], [1, 1, 1, 1], [1, 1], "float32"], {}], "config": {"index": 206661, "code_hash": null, "entity": [["tile_b", "sp", [-1, 1, 1, 1]], ["tile_y", "sp", [-1, 8, 8, 1]], ["tile_x", "sp", [-1, 32, 2, 4]], ["tile_rc", "sp", [-1, 3]], ["auto_unroll_max_step", "ot", 1500], ["unroll_explicit", "ot", 0]]}, "result": [[0.0005603404509345794], 0, 6.3680338859558105, 1623583443.3650463], "version": 0.2, "tvm_version": "0.8.dev0"}
{"input": ["cuda -keys=cuda,gpu -max_num_threads=1024 -model=unknown -thread_warp_size=32", "conv2d_nchw_winograd.cuda", [["TENSOR", [1, 3, 256, 256], "float32"], ["TENSOR", [64, 3, 3, 3], "float32"], [1, 1], [1, 1, 1, 1], [1, 1], "float32"], {}], "config": {"index": 378577, "code_hash": null, "entity": [["tile_b", "sp", [-1, 1, 1, 1]], ["tile_y", "sp", [-1, 1, 8, 8]], ["tile_x", "sp", [-1, 2, 4, 128]], ["tile_rc", "sp", [-1, 3]], ["auto_unroll_max_step", "ot", 128], ["unroll_explicit", "ot", 1]]}, "result": [[0.0007992727814569537], 0, 4.220872163772583, 1623583445.1371248], "version": 0.2, "tvm_version": "0.8.dev0"}
{"input": ["cuda -keys=cuda,gpu -max_num_threads=1024 -model=unknown -thread_warp_size=32", "conv2d_nchw_winograd.cuda", [["TENSOR", [1, 3, 256, 256], "float32"], ["TENSOR", [64, 3, 3, 3], "float32"], [1, 1], [1, 1, 1, 1], [1, 1], "float32"], {}], "config": {"index": 316307, "code_hash": null, "entity": [["tile_b", "sp", [-1, 1, 1, 1]], ["tile_y", "sp", [-1, 2, 16, 2]], ["tile_x", "sp", [-1, 2, 8, 2]], ["tile_rc", "sp", [-1, 1]], ["auto_unroll_max_step", "ot", 128], ["unroll_explicit", "ot", 1]]}, "result": [[8.50348436838391e-05], 0, 3.607440233230591, 1623583446.653813], "version": 0.2, "tvm_version": "0.8.dev0"}
{"input": ["cuda -keys=cuda,gpu -max_num_threads=1024 -model=unknown -thread_warp_size=32", "conv2d_nchw_winograd.cuda", [["TENSOR", [1, 3, 256, 256], "float32"], ["TENSOR", [64, 3, 3, 3], "float32"], [1, 1], [1, 1, 1, 1], [1, 1], "float32"], {}], "config": {"index": 212772, "code_hash": null, "entity": [["tile_b", "sp", [-1, 1, 1, 1]], ["tile_y", "sp", [-1, 1, 1, 1]], ["tile_x", "sp", [-1, 16, 4, 8]], ["tile_rc", "sp", [-1, 3]], ["auto_unroll_max_step", "ot", 1500], ["unroll_explicit", "ot", 0]]}, "result": [[0.0003641950692771084], 0, 5.7923407554626465, 1623583457.0453212], "version": 0.2, "tvm_version": "0.8.dev0"}
{"input": ["cuda -keys=cuda,gpu -max_num_threads=1024 -model=unknown -thread_warp_size=32", "conv2d_nchw_winograd.cuda", [["TENSOR", [1, 3, 256, 256], "float32"], ["TENSOR", [64, 3, 3, 3], "float32"], [1, 1], [1, 1, 1, 1], [1, 1], "float32"], {}], "config": {"index": 200340, "code_hash": null, "entity": [["tile_b", "sp", [-1, 1, 1, 1]], ["tile_y", "sp", [-1, 1, 1, 1]], ["tile_x", "sp", [-1, 128, 2, 2]], ["tile_rc", "sp", [-1, 3]], ["auto_unroll_max_step", "ot", 1500], ["unroll_explicit", "ot", 0]]}, "result": [[0.0009225158527607361], 0, 10.734244346618652, 1623583460.2094727], "version": 0.2, "tvm_version": "0.8.dev0"}
{"input": ["cuda -keys=cuda,gpu -max_num_threads=1024 -model=unknown -thread_warp_size=32", "conv2d_nchw_winograd.cuda", [["TENSOR", [1, 3, 256, 256], "float32"], ["TENSOR", [64, 3, 3, 3], "float32"], [1, 1], [1, 1, 1, 1], [1, 1], "float32"], {}], "config": {"index": 332674, "code_hash": null, "entity": [["tile_b", "sp", [-1, 1, 1, 1]], ["tile_y", "sp", [-1, 1, 2, 2]], ["tile_x", "sp", [-1, 1, 16, 16]], ["tile_rc", "sp", [-1, 1]], ["auto_unroll_max_step", "ot", 128], ["unroll_explicit", "ot", 1]]}, "result": [[0.0002240863660797034], 0, 3.69258451461792, 1623583461.7952316], "version": 0.2, "tvm_version": "0.8.dev0"}
{"input": ["cuda -keys=cuda,gpu -max_num_threads=1024 -model=unknown -thread_warp_size=32", "conv2d_nchw_winograd.cuda", [["TENSOR", [1, 3, 256, 256], "float32"], ["TENSOR", [64, 3, 3, 3], "float32"], [1, 1], [1, 1, 1, 1], [1, 1], "float32"], {}], "config": {"index": 323075, "code_hash": null, "entity": [["tile_b", "sp", [-1, 1, 1, 1]], ["tile_y", "sp", [-1, 16, 2, 1]], ["tile_x", "sp", [-1, 128, 8, 4]], ["tile_rc", "sp", [-1, 1]], ["auto_unroll_max_step", "ot", 128], ["unroll_explicit", "ot", 1]]}, "result": [[0.003170322083333333], 0, 3.3787600994110107, 1623583463.076799], "version": 0.2, "tvm_version": "0.8.dev0"}
{"input": ["cuda -keys=cuda,gpu -max_num_threads=1024 -model=unknown -thread_warp_size=32", "conv2d_nchw_winograd.cuda", [["TENSOR", [1, 3, 256, 256], "float32"], ["TENSOR", [64, 3, 3, 3], "float32"], [1, 1], [1, 1, 1, 1], [1, 1], "float32"], {}], "config": {"index": 53560, "code_hash": null, "entity": [["tile_b", "sp", [-1, 1, 1, 1]], ["tile_y", "sp", [-1, 8, 1, 4]], ["tile_x", "sp", [-1, 4, 2, 4]], ["tile_rc", "sp", [-1, 3]], ["auto_unroll_max_step", "ot", 0], ["unroll_explicit", "ot", 0]]}, "result": [[0.0024535822419354835], 0, 3.9648282527923584, 1623583464.3508415], "version": 0.2, "tvm_version": "0.8.dev0"}
{"input": ["cuda -keys=cuda,gpu -max_num_threads=1024 -model=unknown -thread_warp_size=32", "conv2d_nchw_winograd.cuda", [["TENSOR", [1, 3, 256, 256], "float32"], ["TENSOR", [64, 3, 3, 3], "float32"], [1, 1], [1, 1, 1, 1], [1, 1], "float32"], {}], "config": {"index": 221646, "code_hash": null, "entity": [["tile_b", "sp", [-1, 1, 1, 1]], ["tile_y", "sp", [-1, 1, 2, 4]], ["tile_x", "sp", [-1, 4, 16, 32]], ["tile_rc", "sp", [-1, 3]], ["auto_unroll_max_step", "ot", 1500], ["unroll_explicit", "ot", 0]]}, "result": [[0.0004116626374570447], 0, 4.702215909957886, 1623583466.2191837], "version": 0.2, "tvm_version": "0.8.dev0"}
{"input": ["cuda -keys=cuda,gpu -max_num_threads=1024 -model=unknown -thread_warp_size=32", "conv2d_nchw_winograd.cuda", [["TENSOR", [1, 3, 256, 256], "float32"], ["TENSOR", [64, 3, 3, 3], "float32"], [1, 1], [1, 1, 1, 1], [1, 1], "float32"], {}], "config": {"index": 204856, "code_hash": null, "entity": [["tile_b", "sp", [-1, 1, 1, 1]], ["tile_y", "sp", [-1, 1, 1, 8]], ["tile_x", "sp", [-1, 1, 512, 2]], ["tile_rc", "sp", [-1, 3]], ["auto_unroll_max_step", "ot", 1500], ["unroll_explicit", "ot", 0]]}, "result": [[8.237502766393443e-05], 0, 3.3330368995666504, 1623583467.7076929], "version": 0.2, "tvm_version": "0.8.dev0"}
{"input": ["cuda -keys=cuda,gpu -max_num_threads=1024 -model=unknown -thread_warp_size=32", "conv2d_nchw_winograd.cuda", [["TENSOR", [1, 3, 256, 256], "float32"], ["TENSOR", [64, 3, 3, 3], "float32"], [1, 1], [1, 1, 1, 1], [1, 1], "float32"], {}], "config": {"index": 284737, "code_hash": null, "entity": [["tile_b", "sp", [-1, 1, 1, 1]], ["tile_y", "sp", [-1, 1, 8, 4]], ["tile_x", "sp", [-1, 32, 8, 4]], ["tile_rc", "sp", [-1, 3]], ["auto_unroll_max_step", "ot", 0], ["unroll_explicit", "ot", 1]]}, "result": [[0.0002822364261704682], 0, 4.0942089557647705, 1623583469.3605044], "version": 0.2, "tvm_version": "0.8.dev0"}
{"input": ["cuda -keys=cuda,gpu -max_num_threads=1024 -model=unknown -thread_warp_size=32", "conv2d_nchw_winograd.cuda", [["TENSOR", [1, 3, 256, 256], "float32"], ["TENSOR", [64, 3, 3, 3], "float32"], [1, 1], [1, 1, 1, 1], [1, 1], "float32"], {}], "config": {"index": 404818, "code_hash": null, "entity": [["tile_b", "sp", [-1, 1, 1, 1]], ["tile_y", "sp", [-1, 1, 16, 1]], ["tile_x", "sp", [-1, 1, 16, 8]], ["tile_rc", "sp", [-1, 1]], ["auto_unroll_max_step", "ot", 1500], ["unroll_explicit", "ot", 1]]}, "result": [[0.0001852390756880734], 0, 3.449166774749756, 1623583470.8602266], "version": 0.2, "tvm_version": "0.8.dev0"}
{"input": ["cuda -keys=cuda,gpu -max_num_threads=1024 -model=unknown -thread_warp_size=32", "conv2d_nchw_winograd.cuda", [["TENSOR", [1, 3, 256, 256], "float32"], ["TENSOR", [64, 3, 3, 3], "float32"], [1, 1], [1, 1, 1, 1], [1, 1], "float32"], {}], "config": {"index": 143752, "code_hash": null, "entity": [["tile_b", "sp", [-1, 1, 1, 1]], ["tile_y", "sp", [-1, 1, 1, 2]], ["tile_x", "sp", [-1, 8, 2, 32]], ["tile_rc", "sp", [-1, 3]], ["auto_unroll_max_step", "ot", 128], ["unroll_explicit", "ot", 0]]}, "result": [[0.00236182053125], 0, 3.5802628993988037, 1623583472.0308156], "version": 0.2, "tvm_version": "0.8.dev0"}
{"input": ["cuda -keys=cuda,gpu -max_num_threads=1024 -model=unknown -thread_warp_size=32", "conv2d_nchw_winograd.cuda", [["TENSOR", [1, 3, 256, 256], "float32"], ["TENSOR", [64, 3, 3, 3], "float32"], [1, 1], [1, 1, 1, 1], [1, 1], "float32"], {}], "config": {"index": 109863, "code_hash": null, "entity": [["tile_b", "sp", [-1, 1, 1, 1]], ["tile_y", "sp", [-1, 2, 1, 16]], ["tile_x", "sp", [-1, 2, 32, 64]], ["tile_rc", "sp", [-1, 1]], ["auto_unroll_max_step", "ot", 128], ["unroll_explicit", "ot", 0]]}, "result": [[0.0013132375652173914], 0, 3.947676420211792, 1623583473.2678802], "version": 0.2, "tvm_version": "0.8.dev0"}
{"input": ["cuda -keys=cuda,gpu -max_num_threads=1024 -model=unknown -thread_warp_size=32", "conv2d_nchw_winograd.cuda", [["TENSOR", [1, 3, 256, 256], "float32"], ["TENSOR", [64, 3, 3, 3], "float32"], [1, 1], [1, 1, 1, 1], [1, 1], "float32"], {}], "config": {"index": 163459, "code_hash": null, "entity": [["tile_b", "sp", [-1, 1, 1, 1]], ["tile_y", "sp", [-1, 1, 4, 16]], ["tile_x", "sp", [-1, 2, 8, 2]], ["tile_rc", "sp", [-1, 1]], ["auto_unroll_max_step", "ot", 1500], ["unroll_explicit", "ot", 0]]}, "result": [[8.613260200788813e-05], 0, 3.8368160724639893, 1623583474.7554755], "version": 0.2, "tvm_version": "0.8.dev0"}
{"input": ["cuda -keys=cuda,gpu -max_num_threads=1024 -model=unknown -thread_warp_size=32", "conv2d_nchw_winograd.cuda", [["TENSOR", [1, 3, 256, 256], "float32"], ["TENSOR", [64, 3, 3, 3], "float32"], [1, 1], [1, 1, 1, 1], [1, 1], "float32"], {}], "config": {"index": 170207, "code_hash": null, "entity": [["tile_b", "sp", [-1, 1, 1, 1]], ["tile_y", "sp", [-1, 2, 16, 1]], ["tile_x", "sp", [-1, 128, 8, 4]], ["tile_rc", "sp", [-1, 1]], ["auto_unroll_max_step", "ot", 1500], ["unroll_explicit", "ot", 0]]}, "result": [[0.0004129922491289198], 0, 6.890951633453369, 1623583476.9240212], "version": 0.2, "tvm_version": "0.8.dev0"}
{"input": ["cuda -keys=cuda,gpu -max_num_threads=1024 -model=unknown -thread_warp_size=32", "conv2d_nchw_winograd.cuda", [["TENSOR", [1, 3, 256, 256], "float32"], ["TENSOR", [64, 3, 3, 3], "float32"], [1, 1], [1, 1, 1, 1], [1, 1], "float32"], {}], "config": {"index": 266132, "code_hash": null, "entity": [["tile_b", "sp", [-1, 1, 1, 1]], ["tile_y", "sp", [-1, 4, 8, 1]], ["tile_x", "sp", [-1, 8, 1, 512]], ["tile_rc", "sp", [-1, 1]], ["auto_unroll_max_step", "ot", 0], ["unroll_explicit", "ot", 1]]}, "result": [[0.004262553361111111], 0, 3.5181596279144287, 1623583478.1383283], "version": 0.2, "tvm_version": "0.8.dev0"}
{"input": ["cuda -keys=cuda,gpu -max_num_threads=1024 -model=unknown -thread_warp_size=32", "conv2d_nchw_winograd.cuda", [["TENSOR", [1, 3, 256, 256], "float32"], ["TENSOR", [64, 3, 3, 3], "float32"], [1, 1], [1, 1, 1, 1], [1, 1], "float32"], {}], "config": {"index": 50073, "code_hash": null, "entity": [["tile_b", "sp", [-1, 1, 1, 1]], ["tile_y", "sp", [-1, 4, 2, 1]], ["tile_x", "sp", [-1, 1, 32, 2]], ["tile_rc", "sp", [-1, 3]], ["auto_unroll_max_step", "ot", 0], ["unroll_explicit", "ot", 0]]}, "result": [[8.135215075885328e-05], 0, 5.0565197467803955, 1623583706.248597], "version": 0.2, "tvm_version": "0.8.dev0"}
{"input": ["cuda -keys=cuda,gpu -max_num_threads=1024 -model=unknown -thread_warp_size=32", "conv2d_nchw_winograd.cuda", [["TENSOR", [1, 3, 256, 256], "float32"], ["TENSOR", [64, 3, 3, 3], "float32"], [1, 1], [1, 1, 1, 1], [1, 1], "float32"], {}], "config": {"index": 279393, "code_hash": null, "entity": [["tile_b", "sp", [-1, 1, 1, 1]], ["tile_y", "sp", [-1, 4, 2, 1]], ["tile_x", "sp", [-1, 1, 32, 2]], ["tile_rc", "sp", [-1, 3]], ["auto_unroll_max_step", "ot", 0], ["unroll_explicit", "ot", 1]]}, "result": [[8.07551897418706e-05], 0, 4.147210121154785, 1623583707.8027806], "version": 0.2, "tvm_version": "0.8.dev0"}
{"input": ["cuda -keys=cuda,gpu -max_num_threads=1024 -model=unknown -thread_warp_size=32", "conv2d_nchw_winograd.cuda", [["TENSOR", [1, 3, 256, 256], "float32"], ["TENSOR", [64, 3, 3, 3], "float32"], [1, 1], [1, 1, 1, 1], [1, 1], "float32"], {}], "config": {"index": 126513, "code_hash": null, "entity": [["tile_b", "sp", [-1, 1, 1, 1]], ["tile_y", "sp", [-1, 4, 2, 1]], ["tile_x", "sp", [-1, 1, 32, 2]], ["tile_rc", "sp", [-1, 3]], ["auto_unroll_max_step", "ot", 128], ["unroll_explicit", "ot", 0]]}, "result": [[8.113193304172273e-05], 0, 4.641084432601929, 1623583709.805435], "version": 0.2, "tvm_version": "0.8.dev0"}
{"input": ["cuda -keys=cuda,gpu -max_num_threads=1024 -model=unknown -thread_warp_size=32", "conv2d_nchw_winograd.cuda", [["TENSOR", [1, 3, 256, 256], "float32"], ["TENSOR", [64, 3, 3, 3], "float32"], [1, 1], [1, 1, 1, 1], [1, 1], "float32"], {}], "config": {"index": 202953, "code_hash": null, "entity": [["tile_b", "sp", [-1, 1, 1, 1]], ["tile_y", "sp", [-1, 4, 2, 1]], ["tile_x", "sp", [-1, 1, 32, 2]], ["tile_rc", "sp", [-1, 3]], ["auto_unroll_max_step", "ot", 1500], ["unroll_explicit", "ot", 0]]}, "result": [[8.083090829694323e-05], 0, 4.275628089904785, 1623583711.595563], "version": 0.2, "tvm_version": "0.8.dev0"}
{"input": ["cuda -keys=cuda,gpu -max_num_threads=1024 -model=unknown -thread_warp_size=32", "conv2d_nchw_winograd.cuda", [["TENSOR", [1, 3, 256, 256], "float32"], ["TENSOR", [64, 3, 3, 3], "float32"], [1, 1], [1, 1, 1, 1], [1, 1], "float32"], {}], "config": {"index": 11996, "code_hash": null, "entity": [["tile_b", "sp", [-1, 1, 1, 1]], ["tile_y", "sp", [-1, 1, 2, 8]], ["tile_x", "sp", [-1, 2, 32, 2]], ["tile_rc", "sp", [-1, 1]], ["auto_unroll_max_step", "ot", 0], ["unroll_explicit", "ot", 0]]}, "result": [[8.165630842391306e-05], 0, 4.839513063430786, 1623583713.6766071], "version": 0.2, "tvm_version": "0.8.dev0"}
{"input": ["cuda -keys=cuda,gpu -max_num_threads=1024 -model=unknown -thread_warp_size=32", "conv2d_nchw_winograd.cuda", [["TENSOR", [1, 3, 256, 256], "float32"], ["TENSOR", [64, 3, 3, 3], "float32"], [1, 1], [1, 1, 1, 1], [1, 1], "float32"], {}], "config": {"index": 49490, "code_hash": null, "entity": [["tile_b", "sp", [-1, 1, 1, 1]], ["tile_y", "sp", [-1, 2, 4, 1]], ["tile_x", "sp", [-1, 2, 16, 2]], ["tile_rc", "sp", [-1, 3]], ["auto_unroll_max_step", "ot", 0], ["unroll_explicit", "ot", 0]]}, "result": [[8.117804249578414e-05], 0, 4.688487768173218, 1623583715.8746252], "version": 0.2, "tvm_version": "0.8.dev0"}
{"input": ["cuda -keys=cuda,gpu -max_num_threads=1024 -model=unknown -thread_warp_size=32", "conv2d_nchw_winograd.cuda", [["TENSOR", [1, 3, 256, 256], "float32"], ["TENSOR", [64, 3, 3, 3], "float32"], [1, 1], [1, 1, 1, 1], [1, 1], "float32"], {}], "config": {"index": 42959, "code_hash": null, "entity": [["tile_b", "sp", [-1, 1, 1, 1]], ["tile_y", "sp", [-1, 2, 2, 2]], ["tile_x", "sp", [-1, 2, 32, 1]], ["tile_rc", "sp", [-1, 3]], ["auto_unroll_max_step", "ot", 0], ["unroll_explicit", "ot", 0]]}, "result": [[8.118048716216216e-05], 0, 4.715584754943848, 1623583717.732944], "version": 0.2, "tvm_version": "0.8.dev0"}
{"input": ["cuda -keys=cuda,gpu -max_num_threads=1024 -model=unknown -thread_warp_size=32", "conv2d_nchw_winograd.cuda", [["TENSOR", [1, 3, 256, 256], "float32"], ["TENSOR", [64, 3, 3, 3], "float32"], [1, 1], [1, 1, 1, 1], [1, 1], "float32"], {}], "config": {"index": 241316, "code_hash": null, "entity": [["tile_b", "sp", [-1, 1, 1, 1]], ["tile_y", "sp", [-1, 1, 2, 8]], ["tile_x", "sp", [-1, 2, 32, 2]], ["tile_rc", "sp", [-1, 1]], ["auto_unroll_max_step", "ot", 0], ["unroll_explicit", "ot", 1]]}, "result": [[8.166822640868975e-05], 0, 4.2798011302948, 1623583719.4426255], "version": 0.2, "tvm_version": "0.8.dev0"}
{"input": ["cuda -keys=cuda,gpu -max_num_threads=1024 -model=unknown -thread_warp_size=32", "conv2d_nchw_winograd.cuda", [["TENSOR", [1, 3, 256, 256], "float32"], ["TENSOR", [64, 3, 3, 3], "float32"], [1, 1], [1, 1, 1, 1], [1, 1], "float32"], {}], "config": {"index": 48818, "code_hash": null, "entity": [["tile_b", "sp", [-1, 1, 1, 1]], ["tile_y", "sp", [-1, 2, 4, 1]], ["tile_x", "sp", [-1, 4, 8, 2]], ["tile_rc", "sp", [-1, 3]], ["auto_unroll_max_step", "ot", 0], ["unroll_explicit", "ot", 0]]}, "result": [[8.158819478319784e-05], 0, 4.385433673858643, 1623583721.3468926], "version": 0.2, "tvm_version": "0.8.dev0"}
{"input": ["cuda -keys=cuda,gpu -max_num_threads=1024 -model=unknown -thread_warp_size=32", "conv2d_nchw_winograd.cuda", [["TENSOR", [1, 3, 256, 256], "float32"], ["TENSOR", [64, 3, 3, 3], "float32"], [1, 1], [1, 1, 1, 1], [1, 1], "float32"], {}], "config": {"index": 50161, "code_hash": null, "entity": [["tile_b", "sp", [-1, 1, 1, 1]], ["tile_y", "sp", [-1, 1, 4, 1]], ["tile_x", "sp", [-1, 2, 32, 2]], ["tile_rc", "sp", [-1, 3]], ["auto_unroll_max_step", "ot", 0], ["unroll_explicit", "ot", 0]]}, "result": [[8.109875910931173e-05], 0, 4.219956159591675, 1623583723.236306], "version": 0.2, "tvm_version": "0.8.dev0"}
{"input": ["cuda -keys=cuda,gpu -max_num_threads=1024 -model=unknown -thread_warp_size=32", "conv2d_nchw_winograd.cuda", [["TENSOR", [1, 3, 256, 256], "float32"], ["TENSOR", [64, 3, 3, 3], "float32"], [1, 1], [1, 1, 1, 1], [1, 1], "float32"], {}], "config": {"index": 48822, "code_hash": null, "entity": [["tile_b", "sp", [-1, 1, 1, 1]], ["tile_y", "sp", [-1, 1, 8, 1]], ["tile_x", "sp", [-1, 4, 8, 2]], ["tile_rc", "sp", [-1, 3]], ["auto_unroll_max_step", "ot", 0], ["unroll_explicit", "ot", 0]]}, "result": [[8.162497488971835e-05], 0, 4.492047548294067, 1623583725.3003259], "version": 0.2, "tvm_version": "0.8.dev0"}
{"input": ["cuda -keys=cuda,gpu -max_num_threads=1024 -model=unknown -thread_warp_size=32", "conv2d_nchw_winograd.cuda", [["TENSOR", [1, 3, 256, 256], "float32"], ["TENSOR", [64, 3, 3, 3], "float32"], [1, 1], [1, 1, 1, 1], [1, 1], "float32"], {}], "config": {"index": 50156, "code_hash": null, "entity": [["tile_b", "sp", [-1, 1, 1, 1]], ["tile_y", "sp", [-1, 2, 2, 1]], ["tile_x", "sp", [-1, 2, 32, 2]], ["tile_rc", "sp", [-1, 3]], ["auto_unroll_max_step", "ot", 0], ["unroll_explicit", "ot", 0]]}, "result": [[8.065137752355317e-05], 0, 4.603999853134155, 1623583727.1998374], "version": 0.2, "tvm_version": "0.8.dev0"}
{"input": ["cuda -keys=cuda,gpu -max_num_threads=1024 -model=unknown -thread_warp_size=32", "conv2d_nchw_winograd.cuda", [["TENSOR", [1, 3, 256, 256], "float32"], ["TENSOR", [64, 3, 3, 3], "float32"], [1, 1], [1, 1, 1, 1], [1, 1], "float32"], {}], "config": {"index": 4688, "code_hash": null, "entity": [["tile_b", "sp", [-1, 1, 1, 1]], ["tile_y", "sp", [-1, 1, 2, 8]], ["tile_x", "sp", [-1, 1, 32, 1]], ["tile_rc", "sp", [-1, 1]], ["auto_unroll_max_step", "ot", 0], ["unroll_explicit", "ot", 0]]}, "result": [[8.163203752985328e-05], 0, 4.232978105545044, 1623583728.951765], "version": 0.2, "tvm_version": "0.8.dev0"}
{"input": ["cuda -keys=cuda,gpu -max_num_threads=1024 -model=unknown -thread_warp_size=32", "conv2d_nchw_winograd.cuda", [["TENSOR", [1, 3, 256, 256], "float32"], ["TENSOR", [64, 3, 3, 3], "float32"], [1, 1], [1, 1, 1, 1], [1, 1], "float32"], {}], "config": {"index": 49573, "code_hash": null, "entity": [["tile_b", "sp", [-1, 1, 1, 1]], ["tile_y", "sp", [-1, 1, 4, 1]], ["tile_x", "sp", [-1, 4, 16, 2]], ["tile_rc", "sp", [-1, 3]], ["auto_unroll_max_step", "ot", 0], ["unroll_explicit", "ot", 0]]}, "result": [[8.12913328836425e-05], 0, 4.103965520858765, 1623583730.5541453], "version": 0.2, "tvm_version": "0.8.dev0"}
{"input": ["cuda -keys=cuda,gpu -max_num_threads=1024 -model=unknown -thread_warp_size=32", "conv2d_nchw_winograd.cuda", [["TENSOR", [1, 3, 256, 256], "float32"], ["TENSOR", [64, 3, 3, 3], "float32"], [1, 1], [1, 1, 1, 1], [1, 1], "float32"], {}], "config": {"index": 88436, "code_hash": null, "entity": [["tile_b", "sp", [-1, 1, 1, 1]], ["tile_y", "sp", [-1, 1, 2, 8]], ["tile_x", "sp", [-1, 2, 32, 2]], ["tile_rc", "sp", [-1, 1]], ["auto_unroll_max_step", "ot", 128], ["unroll_explicit", "ot", 0]]}, "result": [[8.167970977596741e-05], 0, 4.059284210205078, 1623583732.2174323], "version": 0.2, "tvm_version": "0.8.dev0"}
{"input": ["cuda -keys=cuda,gpu -max_num_threads=1024 -model=unknown -thread_warp_size=32", "conv2d_nchw_winograd.cuda", [["TENSOR", [1, 3, 256, 256], "float32"], ["TENSOR", [64, 3, 3, 3], "float32"], [1, 1], [1, 1, 1, 1], [1, 1], "float32"], {}], "config": {"index": 278810, "code_hash": null, "entity": [["tile_b", "sp", [-1, 1, 1, 1]], ["tile_y", "sp", [-1, 2, 4, 1]], ["tile_x", "sp", [-1, 2, 16, 2]], ["tile_rc", "sp", [-1, 3]], ["auto_unroll_max_step", "ot", 0], ["unroll_explicit", "ot", 1]]}, "result": [[8.114817852303522e-05], 0, 3.7506535053253174, 1623583733.7683628], "version": 0.2, "tvm_version": "0.8.dev0"}
{"input": ["cuda -keys=cuda,gpu -max_num_threads=1024 -model=unknown -thread_warp_size=32", "conv2d_nchw_winograd.cuda", [["TENSOR", [1, 3, 256, 256], "float32"], ["TENSOR", [64, 3, 3, 3], "float32"], [1, 1], [1, 1, 1, 1], [1, 1], "float32"], {}], "config": {"index": 49489, "code_hash": null, "entity": [["tile_b", "sp", [-1, 1, 1, 1]], ["tile_y", "sp", [-1, 1, 4, 1]], ["tile_x", "sp", [-1, 2, 16, 2]], ["tile_rc", "sp", [-1, 3]], ["auto_unroll_max_step", "ot", 0], ["unroll_explicit", "ot", 0]]}, "result": [[8.502164046528023e-05], 0, 3.6786949634552, 1623583738.5360553], "version": 0.2, "tvm_version": "0.8.dev0"}
{"input": ["cuda -keys=cuda,gpu -max_num_threads=1024 -model=unknown -thread_warp_size=32", "conv2d_nchw_winograd.cuda", [["TENSOR", [1, 3, 256, 256], "float32"], ["TENSOR", [64, 3, 3, 3], "float32"], [1, 1], [1, 1, 1, 1], [1, 1], "float32"], {}], "config": {"index": 125930, "code_hash": null, "entity": [["tile_b", "sp", [-1, 1, 1, 1]], ["tile_y", "sp", [-1, 2, 4, 1]], ["tile_x", "sp", [-1, 2, 16, 2]], ["tile_rc", "sp", [-1, 3]], ["auto_unroll_max_step", "ot", 128], ["unroll_explicit", "ot", 0]]}, "result": [[8.08845874620829e-05], 0, 3.478010654449463, 1623583740.0496855], "version": 0.2, "tvm_version": "0.8.dev0"}
{"input": ["cuda -keys=cuda,gpu -max_num_threads=1024 -model=unknown -thread_warp_size=32", "conv2d_nchw_winograd.cuda", [["TENSOR", [1, 3, 256, 256], "float32"], ["TENSOR", [64, 3, 3, 3], "float32"], [1, 1], [1, 1, 1, 1], [1, 1], "float32"], {}], "config": {"index": 272279, "code_hash": null, "entity": [["tile_b", "sp", [-1, 1, 1, 1]], ["tile_y", "sp", [-1, 2, 2, 2]], ["tile_x", "sp", [-1, 2, 32, 1]], ["tile_rc", "sp", [-1, 3]], ["auto_unroll_max_step", "ot", 0], ["unroll_explicit", "ot", 1]]}, "result": [[8.122992500848321e-05], 0, 3.3416521549224854, 1623583741.5446823], "version": 0.2, "tvm_version": "0.8.dev0"}
{"input": ["cuda -keys=cuda,gpu -max_num_threads=1024 -model=unknown -thread_warp_size=32", "conv2d_nchw_winograd.cuda", [["TENSOR", [1, 3, 256, 256], "float32"], ["TENSOR", [64, 3, 3, 3], "float32"], [1, 1], [1, 1, 1, 1], [1, 1], "float32"], {}], "config": {"index": 202369, "code_hash": null, "entity": [["tile_b", "sp", [-1, 1, 1, 1]], ["tile_y", "sp", [-1, 1, 4, 1]], ["tile_x", "sp", [-1, 2, 16, 2]], ["tile_rc", "sp", [-1, 3]], ["auto_unroll_max_step", "ot", 1500], ["unroll_explicit", "ot", 0]]}, "result": [[8.523666371681416e-05], 0, 3.5681965351104736, 1623583743.0547287], "version": 0.2, "tvm_version": "0.8.dev0"}
{"input": ["cuda -keys=cuda,gpu -max_num_threads=1024 -model=unknown -thread_warp_size=32", "conv2d_nchw_winograd.cuda", [["TENSOR", [1, 3, 256, 256], "float32"], ["TENSOR", [64, 3, 3, 3], "float32"], [1, 1], [1, 1, 1, 1], [1, 1], "float32"], {}], "config": {"index": 119399, "code_hash": null, "entity": [["tile_b", "sp", [-1, 1, 1, 1]], ["tile_y", "sp", [-1, 2, 2, 2]], ["tile_x", "sp", [-1, 2, 32, 1]], ["tile_rc", "sp", [-1, 3]], ["auto_unroll_max_step", "ot", 128], ["unroll_explicit", "ot", 0]]}, "result": [[8.181111758725857e-05], 0, 3.514317274093628, 1623583744.5050385], "version": 0.2, "tvm_version": "0.8.dev0"}
{"input": ["cuda -keys=cuda,gpu -max_num_threads=1024 -model=unknown -thread_warp_size=32", "conv2d_nchw_winograd.cuda", [["TENSOR", [1, 3, 256, 256], "float32"], ["TENSOR", [64, 3, 3, 3], "float32"], [1, 1], [1, 1, 1, 1], [1, 1], "float32"], {}], "config": {"index": 202370, "code_hash": null, "entity": [["tile_b", "sp", [-1, 1, 1, 1]], ["tile_y", "sp", [-1, 2, 4, 1]], ["tile_x", "sp", [-1, 2, 16, 2]], ["tile_rc", "sp", [-1, 3]], ["auto_unroll_max_step", "ot", 1500], ["unroll_explicit", "ot", 0]]}, "result": [[8.09831771043771e-05], 0, 3.589276075363159, 1623583745.9780812], "version": 0.2, "tvm_version": "0.8.dev0"}
{"input": ["cuda -keys=cuda,gpu -max_num_threads=1024 -model=unknown -thread_warp_size=32", "conv2d_nchw_winograd.cuda", [["TENSOR", [1, 3, 256, 256], "float32"], ["TENSOR", [64, 3, 3, 3], "float32"], [1, 1], [1, 1, 1, 1], [1, 1], "float32"], {}], "config": {"index": 50072, "code_hash": null, "entity": [["tile_b", "sp", [-1, 1, 1, 1]], ["tile_y", "sp", [-1, 2, 2, 1]], ["tile_x", "sp", [-1, 1, 32, 2]], ["tile_rc", "sp", [-1, 3]], ["auto_unroll_max_step", "ot", 0], ["unroll_explicit", "ot", 0]]}, "result": [[8.49021653154741e-05], 0, 3.7936806678771973, 1623583747.577954], "version": 0.2, "tvm_version": "0.8.dev0"}
{"input": ["cuda -keys=cuda,gpu -max_num_threads=1024 -model=unknown -thread_warp_size=32", "conv2d_nchw_winograd.cuda", [["TENSOR", [1, 3, 256, 256], "float32"], ["TENSOR", [64, 3, 3, 3], "float32"], [1, 1], [1, 1, 1, 1], [1, 1], "float32"], {}], "config": {"index": 195839, "code_hash": null, "entity": [["tile_b", "sp", [-1, 1, 1, 1]], ["tile_y", "sp", [-1, 2, 2, 2]], ["tile_x", "sp", [-1, 2, 32, 1]], ["tile_rc", "sp", [-1, 3]], ["auto_unroll_max_step", "ot", 1500], ["unroll_explicit", "ot", 0]]}, "result": [[8.128358807679353e-05], 0, 3.7721469402313232, 1623583749.059432], "version": 0.2, "tvm_version": "0.8.dev0"}
{"input": ["cuda -keys=cuda,gpu -max_num_threads=1024 -model=unknown -thread_warp_size=32", "conv2d_nchw_winograd.cuda", [["TENSOR", [1, 3, 256, 256], "float32"], ["TENSOR", [64, 3, 3, 3], "float32"], [1, 1], [1, 1, 1, 1], [1, 1], "float32"], {}], "config": {"index": 355833, "code_hash": null, "entity": [["tile_b", "sp", [-1, 1, 1, 1]], ["tile_y", "sp", [-1, 4, 2, 1]], ["tile_x", "sp", [-1, 1, 32, 2]], ["tile_rc", "sp", [-1, 3]], ["auto_unroll_max_step", "ot", 128], ["unroll_explicit", "ot", 1]]}, "result": [[8.134746722972972e-05], 0, 3.6726021766662598, 1623583750.6337814], "version": 0.2, "tvm_version": "0.8.dev0"}
{"input": ["cuda -keys=cuda,gpu -max_num_threads=1024 -model=unknown -thread_warp_size=32", "conv2d_nchw_winograd.cuda", [["TENSOR", [1, 3, 256, 256], "float32"], ["TENSOR", [64, 3, 3, 3], "float32"], [1, 1], [1, 1, 1, 1], [1, 1], "float32"], {}], "config": {"index": 278138, "code_hash": null, "entity": [["tile_b", "sp", [-1, 1, 1, 1]], ["tile_y", "sp", [-1, 2, 4, 1]], ["tile_x", "sp", [-1, 4, 8, 2]], ["tile_rc", "sp", [-1, 3]], ["auto_unroll_max_step", "ot", 0], ["unroll_explicit", "ot", 1]]}, "result": [[8.17514606245757e-05], 0, 3.666672706604004, 1623583752.1133366], "version": 0.2, "tvm_version": "0.8.dev0"}
{"input": ["cuda -keys=cuda,gpu -max_num_threads=1024 -model=unknown -thread_warp_size=32", "conv2d_nchw_winograd.cuda", [["TENSOR", [1, 3, 256, 256], "float32"], ["TENSOR", [64, 3, 3, 3], "float32"], [1, 1], [1, 1, 1, 1], [1, 1], "float32"], {}], "config": {"index": 279481, "code_hash": null, "entity": [["tile_b", "sp", [-1, 1, 1, 1]], ["tile_y", "sp", [-1, 1, 4, 1]], ["tile_x", "sp", [-1, 2, 32, 2]], ["tile_rc", "sp", [-1, 3]], ["auto_unroll_max_step", "ot", 0], ["unroll_explicit", "ot", 1]]}, "result": [[8.107103905723906e-05], 0, 3.7260212898254395, 1623583753.6365855], "version": 0.2, "tvm_version": "0.8.dev0"}
{"input": ["cuda -keys=cuda,gpu -max_num_threads=1024 -model=unknown -thread_warp_size=32", "conv2d_nchw_winograd.cuda", [["TENSOR", [1, 3, 256, 256], "float32"], ["TENSOR", [64, 3, 3, 3], "float32"], [1, 1], [1, 1, 1, 1], [1, 1], "float32"], {}], "config": {"index": 125258, "code_hash": null, "entity": [["tile_b", "sp", [-1, 1, 1, 1]], ["tile_y", "sp", [-1, 2, 4, 1]], ["tile_x", "sp", [-1, 4, 8, 2]], ["tile_rc", "sp", [-1, 3]], ["auto_unroll_max_step", "ot", 128], ["unroll_explicit", "ot", 0]]}, "result": [[8.152928127136022e-05], 0, 3.6651034355163574, 1623583755.1340525], "version": 0.2, "tvm_version": "0.8.dev0"}
{"input": ["cuda -keys=cuda,gpu -max_num_threads=1024 -model=unknown -thread_warp_size=32", "conv2d_nchw_winograd.cuda", [["TENSOR", [1, 3, 256, 256], "float32"], ["TENSOR", [64, 3, 3, 3], "float32"], [1, 1], [1, 1, 1, 1], [1, 1], "float32"], {}], "config": {"index": 432273, "code_hash": null, "entity": [["tile_b", "sp", [-1, 1, 1, 1]], ["tile_y", "sp", [-1, 4, 2, 1]], ["tile_x", "sp", [-1, 1, 32, 2]], ["tile_rc", "sp", [-1, 3]], ["auto_unroll_max_step", "ot", 1500], ["unroll_explicit", "ot", 1]]}, "result": [[8.097804782755136e-05], 0, 3.4836831092834473, 1623583756.6027796], "version": 0.2, "tvm_version": "0.8.dev0"}
{"input": ["cuda -keys=cuda,gpu -max_num_threads=1024 -model=unknown -thread_warp_size=32", "conv2d_nchw_winograd.cuda", [["TENSOR", [1, 3, 256, 256], "float32"], ["TENSOR", [64, 3, 3, 3], "float32"], [1, 1], [1, 1, 1, 1], [1, 1], "float32"], {}], "config": {"index": 50162, "code_hash": null, "entity": [["tile_b", "sp", [-1, 1, 1, 1]], ["tile_y", "sp", [-1, 2, 4, 1]], ["tile_x", "sp", [-1, 2, 32, 2]], ["tile_rc", "sp", [-1, 3]], ["auto_unroll_max_step", "ot", 0], ["unroll_explicit", "ot", 0]]}, "result": [[8.093286002691789e-05], 0, 3.7810585498809814, 1623583758.1681287], "version": 0.2, "tvm_version": "0.8.dev0"}
{"input": ["cuda -keys=cuda,gpu -max_num_threads=1024 -model=unknown -thread_warp_size=32", "conv2d_nchw_winograd.cuda", [["TENSOR", [1, 3, 256, 256], "float32"], ["TENSOR", [64, 3, 3, 3], "float32"], [1, 1], [1, 1, 1, 1], [1, 1], "float32"], {}], "config": {"index": 126601, "code_hash": null, "entity": [["tile_b", "sp", [-1, 1, 1, 1]], ["tile_y", "sp", [-1, 1, 4, 1]], ["tile_x", "sp", [-1, 2, 32, 2]], ["tile_rc", "sp", [-1, 3]], ["auto_unroll_max_step", "ot", 128], ["unroll_explicit", "ot", 0]]}, "result": [[8.120188709133805e-05], 0, 3.5036063194274902, 1623583759.6514819], "version": 0.2, "tvm_version": "0.8.dev0"}
{"input": ["cuda -keys=cuda,gpu -max_num_threads=1024 -model=unknown -thread_warp_size=32", "conv2d_nchw_winograd.cuda", [["TENSOR", [1, 3, 256, 256], "float32"], ["TENSOR", [64, 3, 3, 3], "float32"], [1, 1], [1, 1, 1, 1], [1, 1], "float32"], {}], "config": {"index": 4772, "code_hash": null, "entity": [["tile_b", "sp", [-1, 1, 1, 1]], ["tile_y", "sp", [-1, 1, 2, 8]], ["tile_x", "sp", [-1, 2, 32, 1]], ["tile_rc", "sp", [-1, 1]], ["auto_unroll_max_step", "ot", 0], ["unroll_explicit", "ot", 0]]}, "result": [[8.170011379897786e-05], 0, 3.744713068008423, 1623583761.2269232], "version": 0.2, "tvm_version": "0.8.dev0"}
{"input": ["cuda -keys=cuda,gpu -max_num_threads=1024 -model=unknown -thread_warp_size=32", "conv2d_nchw_winograd.cuda", [["TENSOR", [1, 3, 256, 256], "float32"], ["TENSOR", [64, 3, 3, 3], "float32"], [1, 1], [1, 1, 1, 1], [1, 1], "float32"], {}], "config": {"index": 203041, "code_hash": null, "entity": [["tile_b", "sp", [-1, 1, 1, 1]], ["tile_y", "sp", [-1, 1, 4, 1]], ["tile_x", "sp", [-1, 2, 32, 2]], ["tile_rc", "sp", [-1, 3]], ["auto_unroll_max_step", "ot", 1500], ["unroll_explicit", "ot", 0]]}, "result": [[8.081528375209381e-05], 0, 3.943741798400879, 1623583766.5081916], "version": 0.2, "tvm_version": "0.8.dev0"}
{"input": ["cuda -keys=cuda,gpu -max_num_threads=1024 -model=unknown -thread_warp_size=32", "conv2d_nchw_winograd.cuda", [["TENSOR", [1, 3, 256, 256], "float32"], ["TENSOR", [64, 3, 3, 3], "float32"], [1, 1], [1, 1, 1, 1], [1, 1], "float32"], {}], "config": {"index": 165464, "code_hash": null, "entity": [["tile_b", "sp", [-1, 1, 1, 1]], ["tile_y", "sp", [-1, 1, 2, 8]], ["tile_x", "sp", [-1, 2, 64, 2]], ["tile_rc", "sp", [-1, 1]], ["auto_unroll_max_step", "ot", 1500], ["unroll_explicit", "ot", 0]]}, "result": [[8.161542540871934e-05], 0, 4.055369853973389, 1623583768.0895638], "version": 0.2, "tvm_version": "0.8.dev0"}
{"input": ["cuda -keys=cuda,gpu -max_num_threads=1024 -model=unknown -thread_warp_size=32", "conv2d_nchw_winograd.cuda", [["TENSOR", [1, 3, 256, 256], "float32"], ["TENSOR", [64, 3, 3, 3], "float32"], [1, 1], [1, 1, 1, 1], [1, 1], "float32"], {}], "config": {"index": 278142, "code_hash": null, "entity": [["tile_b", "sp", [-1, 1, 1, 1]], ["tile_y", "sp", [-1, 1, 8, 1]], ["tile_x", "sp", [-1, 4, 8, 2]], ["tile_rc", "sp", [-1, 3]], ["auto_unroll_max_step", "ot", 0], ["unroll_explicit", "ot", 1]]}, "result": [[8.11762485627325e-05], 0, 3.864232063293457, 1623583769.6857893], "version": 0.2, "tvm_version": "0.8.dev0"}
{"input": ["cuda -keys=cuda,gpu -max_num_threads=1024 -model=unknown -thread_warp_size=32", "conv2d_nchw_winograd.cuda", [["TENSOR", [1, 3, 256, 256], "float32"], ["TENSOR", [64, 3, 3, 3], "float32"], [1, 1], [1, 1, 1, 1], [1, 1], "float32"], {}], "config": {"index": 279476, "code_hash": null, "entity": [["tile_b", "sp", [-1, 1, 1, 1]], ["tile_y", "sp", [-1, 2, 2, 1]], ["tile_x", "sp", [-1, 2, 32, 2]], ["tile_rc", "sp", [-1, 3]], ["auto_unroll_max_step", "ot", 0], ["unroll_explicit", "ot", 1]]}, "result": [[8.097052220726783e-05], 0, 3.6008219718933105, 1623583771.2172053], "version": 0.2, "tvm_version": "0.8.dev0"}
{"input": ["cuda -keys=cuda,gpu -max_num_threads=1024 -model=unknown -thread_warp_size=32", "conv2d_nchw_winograd.cuda", [["TENSOR", [1, 3, 256, 256], "float32"], ["TENSOR", [64, 3, 3, 3], "float32"], [1, 1], [1, 1, 1, 1], [1, 1], "float32"], {}], "config": {"index": 234008, "code_hash": null, "entity": [["tile_b", "sp", [-1, 1, 1, 1]], ["tile_y", "sp", [-1, 1, 2, 8]], ["tile_x", "sp", [-1, 1, 32, 1]], ["tile_rc", "sp", [-1, 1]], ["auto_unroll_max_step", "ot", 0], ["unroll_explicit", "ot", 1]]}, "result": [[8.165682482245519e-05], 0, 3.5582687854766846, 1623583772.6760886], "version": 0.2, "tvm_version": "0.8.dev0"}
{"input": ["cuda -keys=cuda,gpu -max_num_threads=1024 -model=unknown -thread_warp_size=32", "conv2d_nchw_winograd.cuda", [["TENSOR", [1, 3, 256, 256], "float32"], ["TENSOR", [64, 3, 3, 3], "float32"], [1, 1], [1, 1, 1, 1], [1, 1], "float32"], {}], "config": {"index": 278893, "code_hash": null, "entity": [["tile_b", "sp", [-1, 1, 1, 1]], ["tile_y", "sp", [-1, 1, 4, 1]], ["tile_x", "sp", [-1, 4, 16, 2]], ["tile_rc", "sp", [-1, 3]], ["auto_unroll_max_step", "ot", 0], ["unroll_explicit", "ot", 1]]}, "result": [[8.168687601626016e-05], 0, 4.007601499557495, 1623583774.2499666], "version": 0.2, "tvm_version": "0.8.dev0"}
{"input": ["cuda -keys=cuda,gpu -max_num_threads=1024 -model=unknown -thread_warp_size=32", "conv2d_nchw_winograd.cuda", [["TENSOR", [1, 3, 256, 256], "float32"], ["TENSOR", [64, 3, 3, 3], "float32"], [1, 1], [1, 1, 1, 1], [1, 1], "float32"], {}], "config": {"index": 125262, "code_hash": null, "entity": [["tile_b", "sp", [-1, 1, 1, 1]], ["tile_y", "sp", [-1, 1, 8, 1]], ["tile_x", "sp", [-1, 4, 8, 2]], ["tile_rc", "sp", [-1, 3]], ["auto_unroll_max_step", "ot", 128], ["unroll_explicit", "ot", 0]]}, "result": [[8.19601320176931e-05], 0, 4.04691743850708, 1623583775.8554459], "version": 0.2, "tvm_version": "0.8.dev0"}
{"input": ["cuda -keys=cuda,gpu -max_num_threads=1024 -model=unknown -thread_warp_size=32", "conv2d_nchw_winograd.cuda", [["TENSOR", [1, 3, 256, 256], "float32"], ["TENSOR", [64, 3, 3, 3], "float32"], [1, 1], [1, 1, 1, 1], [1, 1], "float32"], {}], "config": {"index": 126596, "code_hash": null, "entity": [["tile_b", "sp", [-1, 1, 1, 1]], ["tile_y", "sp", [-1, 2, 2, 1]], ["tile_x", "sp", [-1, 2, 32, 2]], ["tile_rc", "sp", [-1, 3]], ["auto_unroll_max_step", "ot", 128], ["unroll_explicit", "ot", 0]]}, "result": [[8.080970961281708e-05], 0, 3.947568893432617, 1623583777.4406416], "version": 0.2, "tvm_version": "0.8.dev0"}
{"input": ["cuda -keys=cuda,gpu -max_num_threads=1024 -model=unknown -thread_warp_size=32", "conv2d_nchw_winograd.cuda", [["TENSOR", [1, 3, 256, 256], "float32"], ["TENSOR", [64, 3, 3, 3], "float32"], [1, 1], [1, 1, 1, 1], [1, 1], "float32"], {}], "config": {"index": 81128, "code_hash": null, "entity": [["tile_b", "sp", [-1, 1, 1, 1]], ["tile_y", "sp", [-1, 1, 2, 8]], ["tile_x", "sp", [-1, 1, 32, 1]], ["tile_rc", "sp", [-1, 1]], ["auto_unroll_max_step", "ot", 128], ["unroll_explicit", "ot", 0]]}, "result": [[8.177318686526743e-05], 0, 3.941195249557495, 1623583778.9136174], "version": 0.2, "tvm_version": "0.8.dev0"}
{"input": ["cuda -keys=cuda,gpu -max_num_threads=1024 -model=unknown -thread_warp_size=32", "conv2d_nchw_winograd.cuda", [["TENSOR", [1, 3, 256, 256], "float32"], ["TENSOR", [64, 3, 3, 3], "float32"], [1, 1], [1, 1, 1, 1], [1, 1], "float32"], {}], "config": {"index": 126013, "code_hash": null, "entity": [["tile_b", "sp", [-1, 1, 1, 1]], ["tile_y", "sp", [-1, 1, 4, 1]], ["tile_x", "sp", [-1, 4, 16, 2]], ["tile_rc", "sp", [-1, 3]], ["auto_unroll_max_step", "ot", 128], ["unroll_explicit", "ot", 0]]}, "result": [[8.156301179642737e-05], 0, 3.718745708465576, 1623583780.3631477], "version": 0.2, "tvm_version": "0.8.dev0"}
{"input": ["cuda -keys=cuda,gpu -max_num_threads=1024 -model=unknown -thread_warp_size=32", "conv2d_nchw_winograd.cuda", [["TENSOR", [1, 3, 256, 256], "float32"], ["TENSOR", [64, 3, 3, 3], "float32"], [1, 1], [1, 1, 1, 1], [1, 1], "float32"], {}], "config": {"index": 317756, "code_hash": null, "entity": [["tile_b", "sp", [-1, 1, 1, 1]], ["tile_y", "sp", [-1, 1, 2, 8]], ["tile_x", "sp", [-1, 2, 32, 2]], ["tile_rc", "sp", [-1, 1]], ["auto_unroll_max_step", "ot", 128], ["unroll_explicit", "ot", 1]]}, "result": [[8.196478462061925e-05], 0, 3.944993257522583, 1623583781.9572623], "version": 0.2, "tvm_version": "0.8.dev0"}
{"input": ["cuda -keys=cuda,gpu -max_num_threads=1024 -model=unknown -thread_warp_size=32", "conv2d_nchw_winograd.cuda", [["TENSOR", [1, 3, 256, 256], "float32"], ["TENSOR", [64, 3, 3, 3], "float32"], [1, 1], [1, 1, 1, 1], [1, 1], "float32"], {}], "config": {"index": 11912, "code_hash": null, "entity": [["tile_b", "sp", [-1, 1, 1, 1]], ["tile_y", "sp", [-1, 1, 2, 8]], ["tile_x", "sp", [-1, 1, 32, 2]], ["tile_rc", "sp", [-1, 1]], ["auto_unroll_max_step", "ot", 0], ["unroll_explicit", "ot", 0]]}, "result": [[8.186129336043361e-05], 0, 3.8336451053619385, 1623583783.528192], "version": 0.2, "tvm_version": "0.8.dev0"}
{"input": ["cuda -keys=cuda,gpu -max_num_threads=1024 -model=unknown -thread_warp_size=32", "conv2d_nchw_winograd.cuda", [["TENSOR", [1, 3, 256, 256], "float32"], ["TENSOR", [64, 3, 3, 3], "float32"], [1, 1], [1, 1, 1, 1], [1, 1], "float32"], {}], "config": {"index": 201702, "code_hash": null, "entity": [["tile_b", "sp", [-1, 1, 1, 1]], ["tile_y", "sp", [-1, 1, 8, 1]], ["tile_x", "sp", [-1, 4, 8, 2]], ["tile_rc", "sp", [-1, 3]], ["auto_unroll_max_step", "ot", 1500], ["unroll_explicit", "ot", 0]]}, "result": [[8.198351994544834e-05], 0, 3.8018317222595215, 1623583785.004429], "version": 0.2, "tvm_version": "0.8.dev0"}
{"input": ["cuda -keys=cuda,gpu -max_num_threads=1024 -model=unknown -thread_warp_size=32", "conv2d_nchw_winograd.cuda", [["TENSOR", [1, 3, 256, 256], "float32"], ["TENSOR", [64, 3, 3, 3], "float32"], [1, 1], [1, 1, 1, 1], [1, 1], "float32"], {}], "config": {"index": 203036, "code_hash": null, "entity": [["tile_b", "sp", [-1, 1, 1, 1]], ["tile_y", "sp", [-1, 2, 2, 1]], ["tile_x", "sp", [-1, 2, 32, 2]], ["tile_rc", "sp", [-1, 3]], ["auto_unroll_max_step", "ot", 1500], ["unroll_explicit", "ot", 0]]}, "result": [[8.118059776725303e-05], 0, 3.945375680923462, 1623583786.5775912], "version": 0.2, "tvm_version": "0.8.dev0"}
{"input": ["cuda -keys=cuda,gpu -max_num_threads=1024 -model=unknown -thread_warp_size=32", "conv2d_nchw_winograd.cuda", [["TENSOR", [1, 3, 256, 256], "float32"], ["TENSOR", [64, 3, 3, 3], "float32"], [1, 1], [1, 1, 1, 1], [1, 1], "float32"], {}], "config": {"index": 12500, "code_hash": null, "entity": [["tile_b", "sp", [-1, 1, 1, 1]], ["tile_y", "sp", [-1, 1, 2, 8]], ["tile_x", "sp", [-1, 1, 64, 2]], ["tile_rc", "sp", [-1, 1]], ["auto_unroll_max_step", "ot", 0], ["unroll_explicit", "ot", 0]]}, "result": [[8.138584375e-05], 0, 3.766921043395996, 1623583788.1294062], "version": 0.2, "tvm_version": "0.8.dev0"}
{"input": ["cuda -keys=cuda,gpu -max_num_threads=1024 -model=unknown -thread_warp_size=32", "conv2d_nchw_winograd.cuda", [["TENSOR", [1, 3, 256, 256], "float32"], ["TENSOR", [64, 3, 3, 3], "float32"], [1, 1], [1, 1, 1, 1], [1, 1], "float32"], {}], "config": {"index": 202453, "code_hash": null, "entity": [["tile_b", "sp", [-1, 1, 1, 1]], ["tile_y", "sp", [-1, 1, 4, 1]], ["tile_x", "sp", [-1, 4, 16, 2]], ["tile_rc", "sp", [-1, 3]], ["auto_unroll_max_step", "ot", 1500], ["unroll_explicit", "ot", 0]]}, "result": [[8.126648952702703e-05], 0, 3.375931739807129, 1623583789.6103332], "version": 0.2, "tvm_version": "0.8.dev0"}
{"input": ["cuda -keys=cuda,gpu -max_num_threads=1024 -model=unknown -thread_warp_size=32", "conv2d_nchw_winograd.cuda", [["TENSOR", [1, 3, 256, 256], "float32"], ["TENSOR", [64, 3, 3, 3], "float32"], [1, 1], [1, 1, 1, 1], [1, 1], "float32"], {}], "config": {"index": 50660, "code_hash": null, "entity": [["tile_b", "sp", [-1, 1, 1, 1]], ["tile_y", "sp", [-1, 2, 2, 1]], ["tile_x", "sp", [-1, 1, 64, 2]], ["tile_rc", "sp", [-1, 3]], ["auto_unroll_max_step", "ot", 0], ["unroll_explicit", "ot", 0]]}, "result": [[8.081162613065326e-05], 0, 4.372277736663818, 1623583800.1065574], "version": 0.2, "tvm_version": "0.8.dev0"}
{"input": ["cuda -keys=cuda,gpu -max_num_threads=1024 -model=unknown -thread_warp_size=32", "conv2d_nchw_winograd.cuda", [["TENSOR", [1, 3, 256, 256], "float32"], ["TENSOR", [64, 3, 3, 3], "float32"], [1, 1], [1, 1, 1, 1], [1, 1], "float32"], {}], "config": {"index": 164876, "code_hash": null, "entity": [["tile_b", "sp", [-1, 1, 1, 1]], ["tile_y", "sp", [-1, 1, 2, 8]], ["tile_x", "sp", [-1, 2, 32, 2]], ["tile_rc", "sp", [-1, 1]], ["auto_unroll_max_step", "ot", 1500], ["unroll_explicit", "ot", 0]]}, "result": [[8.180418764926646e-05], 0, 4.2333385944366455, 1623583801.5655806], "version": 0.2, "tvm_version": "0.8.dev0"}
{"input": ["cuda -keys=cuda,gpu -max_num_threads=1024 -model=unknown -thread_warp_size=32", "conv2d_nchw_winograd.cuda", [["TENSOR", [1, 3, 256, 256], "float32"], ["TENSOR", [64, 3, 3, 3], "float32"], [1, 1], [1, 1, 1, 1], [1, 1], "float32"], {}], "config": {"index": 202952, "code_hash": null, "entity": [["tile_b", "sp", [-1, 1, 1, 1]], ["tile_y", "sp", [-1, 2, 2, 1]], ["tile_x", "sp", [-1, 1, 32, 2]], ["tile_rc", "sp", [-1, 3]], ["auto_unroll_max_step", "ot", 1500], ["unroll_explicit", "ot", 0]]}, "result": [[8.534249328147099e-05], 0, 4.239851474761963, 1623583803.0225537], "version": 0.2, "tvm_version": "0.8.dev0"}
{"input": ["cuda -keys=cuda,gpu -max_num_threads=1024 -model=unknown -thread_warp_size=32", "conv2d_nchw_winograd.cuda", [["TENSOR", [1, 3, 256, 256], "float32"], ["TENSOR", [64, 3, 3, 3], "float32"], [1, 1], [1, 1, 1, 1], [1, 1], "float32"], {}], "config": {"index": 203651, "code_hash": null, "entity": [["tile_b", "sp", [-1, 1, 1, 1]], ["tile_y", "sp", [-1, 2, 2, 2]], ["tile_x", "sp", [-1, 2, 64, 2]], ["tile_rc", "sp", [-1, 3]], ["auto_unroll_max_step", "ot", 1500], ["unroll_explicit", "ot", 0]]}, "result": [[8.115357569585878e-05], 0, 4.823760032653809, 1623583804.6071794], "version": 0.2, "tvm_version": "0.8.dev0"}
