Project_optimizing_U-net/log_files/unet_torch_gpu.log
{"input": ["cuda -keys=cuda,gpu -max_num_threads=1024 -model=unknown -thread_warp_size=32", "conv2d_nchw_winograd.cuda", [["TENSOR", [1, 3, 256, 256], "float32"], ["TENSOR", [64, 3, 3, 3], "float32"], [1, 1], [1, 1, 1, 1], [1, 1], "float32"], {}], "config": {"index": 17442, "code_hash": null, "entity": [["tile_b", "sp", [-1, 1, 1, 1]], ["tile_y", "sp", [-1, 1, 2, 4]], ["tile_x", "sp", [-1, 1, 16, 4]], ["tile_rc", "sp", [-1, 1]], ["auto_unroll_max_step", "ot", 0], ["unroll_explicit", "ot", 0]]}, "result": [[8.053415062059712e-05], 0, 4.36546516418457, 1623661042.0222158], "version": 0.2, "tvm_version": "0.8.dev0"}
{"input": ["cuda -keys=cuda,gpu -max_num_threads=1024 -model=unknown -thread_warp_size=32", "conv2d_nchw.cuda", [["TENSOR", [1, 3, 256, 256], "float32"], ["TENSOR", [64, 3, 3, 3], "float32"], [1, 1], [1, 1, 1, 1], [1, 1], "float32"], {}], "config": {"index": 41597701, "code_hash": null, "entity": [["tile_f", "sp", [-1, 1, 8, 4]], ["tile_y", "sp", [-1, 1, 1, 2]], ["tile_x", "sp", [-1, 2, 16, 1]], ["tile_rc", "sp", [-1, 1]], ["tile_ry", "sp", [-1, 3]], ["tile_rx", "sp", [-1, 1]], ["auto_unroll_max_step", "ot", 1500], ["unroll_explicit", "ot", 0]]}, "result": [[1.8834363251993233e-05], 0, 1.3570446968078613, 1623663015.1239607], "version": 0.2, "tvm_version": "0.8.dev0"}
{"input": ["cuda -keys=cuda,gpu -max_num_threads=1024 -model=unknown -thread_warp_size=32", "conv2d_nchw_winograd.cuda", [["TENSOR", [1, 64, 128, 128], "float32"], ["TENSOR", [128, 64, 3, 3], "float32"], [1, 1], [1, 1, 1, 1], [1, 1], "float32"], {}], "config": {"index": 389737, "code_hash": null, "entity": [["tile_b", "sp", [-1, 1, 1, 1]], ["tile_y", "sp", [-1, 1, 8, 8]], ["tile_x", "sp", [-1, 2, 16, 2]], ["tile_rc", "sp", [-1, 16]], ["auto_unroll_max_step", "ot", 128], ["unroll_explicit", "ot", 0]]}, "result": [[7.173574436767799e-05], 0, 3.648790121078491, 1623664581.8845243], "version": 0.2, "tvm_version": "0.8.dev0"}
{"input": ["cuda -keys=cuda,gpu -max_num_threads=1024 -model=unknown -thread_warp_size=32", "conv2d_nchw.cuda", [["TENSOR", [1, 64, 128, 128], "float32"], ["TENSOR", [128, 64, 3, 3], "float32"], [1, 1], [1, 1, 1, 1], [1, 1], "float32"], {}], "config": {"index": 232694818, "code_hash": null, "entity": [["tile_f", "sp", [-1, 1, 16, 2]], ["tile_y", "sp", [-1, 1, 2, 2]], ["tile_x", "sp", [-1, 1, 8, 4]], ["tile_rc", "sp", [-1, 2]], ["tile_ry", "sp", [-1, 3]], ["tile_rx", "sp", [-1, 3]], ["auto_unroll_max_step", "ot", 512], ["unroll_explicit", "ot", 1]]}, "result": [[0.00017734631322674418], 0, 2.151106119155884, 1623665915.7831404], "version": 0.2, "tvm_version": "0.8.dev0"}
{"input": ["cuda -keys=cuda,gpu -max_num_threads=1024 -model=unknown -thread_warp_size=32", "conv2d_nchw_winograd.cuda", [["TENSOR", [1, 128, 128, 128], "float32"], ["TENSOR", [128, 128, 3, 3], "float32"], [1, 1], [1, 1, 1, 1], [1, 1], "float32"], {}], "config": {"index": 424057, "code_hash": null, "entity": [["tile_b", "sp", [-1, 1, 1, 1]], ["tile_y", "sp", [-1, 1, 8, 8]], ["tile_x", "sp", [-1, 2, 16, 2]], ["tile_rc", "sp", [-1, 16]], ["auto_unroll_max_step", "ot", 128], ["unroll_explicit", "ot", 0]]}, "result": [[0.00012252167475973696], 0, 4.229072093963623, 1623666557.9624438], "version": 0.2, "tvm_version": "0.8.dev0"}
{"input": ["cuda -keys=cuda,gpu -max_num_threads=1024 -model=unknown -thread_warp_size=32", "conv2d_nchw.cuda", [["TENSOR", [1, 128, 128, 128], "float32"], ["TENSOR", [128, 128, 3, 3], "float32"], [1, 1], [1, 1, 1, 1], [1, 1], "float32"], {}], "config": {"index": 322551555, "code_hash": null, "entity": [["tile_f", "sp", [-1, 1, 4, 4]], ["tile_y", "sp", [-1, 1, 4, 2]], ["tile_x", "sp", [-1, 1, 8, 4]], ["tile_rc", "sp", [-1, 4]], ["tile_ry", "sp", [-1, 3]], ["tile_rx", "sp", [-1, 3]], ["auto_unroll_max_step", "ot", 1500], ["unroll_explicit", "ot", 1]]}, "result": [[0.000319902417721519], 0, 3.187417984008789, 1623667835.4348078], "version": 0.2, "tvm_version": "0.8.dev0"}
{"input": ["cuda -keys=cuda,gpu -max_num_threads=1024 -model=unknown -thread_warp_size=32", "conv2d_nchw_winograd.cuda", [["TENSOR", [1, 128, 64, 64], "float32"], ["TENSOR", [256, 128, 3, 3], "float32"], [1, 1], [1, 1, 1, 1], [1, 1], "float32"], {}], "config": {"index": 338704, "code_hash": null, "entity": [["tile_b", "sp", [-1, 1, 1, 1]], ["tile_y", "sp", [-1, 1, 8, 8]], ["tile_x", "sp", [-1, 2, 16, 2]], ["tile_rc", "sp", [-1, 16]], ["auto_unroll_max_step", "ot", 128], ["unroll_explicit", "ot", 0]]}, "result": [[6.24737638888889e-05], 0, 3.7811062335968018, 1623669251.1670105], "version": 0.2, "tvm_version": "0.8.dev0"}
{"input": ["cuda -keys=cuda,gpu -max_num_threads=1024 -model=unknown -thread_warp_size=32", "conv2d_nchw.cuda", [["TENSOR", [1, 128, 64, 64], "float32"], ["TENSOR", [256, 128, 3, 3], "float32"], [1, 1], [1, 1, 1, 1], [1, 1], "float32"], {}], "config": {"index": 218355291, "code_hash": null, "entity": [["tile_f", "sp", [-1, 1, 8, 2]], ["tile_y", "sp", [-1, 2, 1, 2]], ["tile_x", "sp", [-1, 1, 16, 2]], ["tile_rc", "sp", [-1, 8]], ["tile_ry", "sp", [-1, 3]], ["tile_rx", "sp", [-1, 3]], ["auto_unroll_max_step", "ot", 1500], ["unroll_explicit", "ot", 1]]}, "result": [[0.0001722759650112867], 0, 3.216353416442871, 1623670243.6893423], "version": 0.2, "tvm_version": "0.8.dev0"}
{"input": ["cuda -keys=cuda,gpu -max_num_threads=1024 -model=unknown -thread_warp_size=32", "conv2d_nchw_winograd.cuda", [["TENSOR", [1, 256, 64, 64], "float32"], ["TENSOR", [256, 256, 3, 3], "float32"], [1, 1], [1, 1, 1, 1], [1, 1], "float32"], {}], "config": {"index": 883204, "code_hash": null, "entity": [["tile_b", "sp", [-1, 1, 1, 1]], ["tile_y", "sp", [-1, 1, 8, 8]], ["tile_x", "sp", [-1, 2, 16, 2]], ["tile_rc", "sp", [-1, 32]], ["auto_unroll_max_step", "ot", 0], ["unroll_explicit", "ot", 1]]}, "result": [[0.00011040444805194805], 0, 3.4989991188049316, 1623670991.938748], "version": 0.2, "tvm_version": "0.8.dev0"}
{"input": ["cuda -keys=cuda,gpu -max_num_threads=1024 -model=unknown -thread_warp_size=32", "conv2d_nchw.cuda", [["TENSOR", [1, 256, 64, 64], "float32"], ["TENSOR", [256, 256, 3, 3], "float32"], [1, 1], [1, 1, 1, 1], [1, 1], "float32"], {}], "config": {"index": 245132770, "code_hash": null, "entity": [["tile_f", "sp", [-1, 2, 8, 1]], ["tile_y", "sp", [-1, 2, 1, 2]], ["tile_x", "sp", [-1, 1, 16, 2]], ["tile_rc", "sp", [-1, 8]], ["tile_ry", "sp", [-1, 3]], ["tile_rx", "sp", [-1, 3]], ["auto_unroll_max_step", "ot", 1500], ["unroll_explicit", "ot", 1]]}, "result": [[0.00033925368292682926], 0, 3.2178115844726562, 1623672083.1752625], "version": 0.2, "tvm_version": "0.8.dev0"}
{"input": ["cuda -keys=cuda,gpu -max_num_threads=1024 -model=unknown -thread_warp_size=32", "conv2d_nchw_winograd.cuda", [["TENSOR", [1, 256, 32, 32], "float32"], ["TENSOR", [512, 256, 3, 3], "float32"], [1, 1], [1, 1, 1, 1], [1, 1], "float32"], {}], "config": {"index": 623826, "code_hash": null, "entity": [["tile_b", "sp", [-1, 1, 1, 1]], ["tile_y", "sp", [-1, 1, 16, 4]], ["tile_x", "sp", [-1, 1, 16, 4]], ["tile_rc", "sp", [-1, 64]], ["auto_unroll_max_step", "ot", 0], ["unroll_explicit", "ot", 1]]}, "result": [[6.014562587939698e-05], 0, 3.1933772563934326, 1623673543.5439942], "version": 0.2, "tvm_version": "0.8.dev0"}
{"input": ["cuda -keys=cuda,gpu -max_num_threads=1024 -model=unknown -thread_warp_size=32", "conv2d_nchw.cuda", [["TENSOR", [1, 256, 32, 32], "float32"], ["TENSOR", [512, 256, 3, 3], "float32"], [1, 1], [1, 1, 1, 1], [1, 1], "float32"], {}], "config": {"index": 145316885, "code_hash": null, "entity": [["tile_f", "sp", [-1, 2, 2, 2]], ["tile_y", "sp", [-1, 1, 4, 1]], ["tile_x", "sp", [-1, 1, 16, 2]], ["tile_rc", "sp", [-1, 8]], ["tile_ry", "sp", [-1, 3]], ["tile_rx", "sp", [-1, 3]], ["auto_unroll_max_step", "ot", 1500], ["unroll_explicit", "ot", 1]]}, "result": [[0.00019852596525096522], 0, 1.999469518661499, 1623674256.9179852], "version": 0.2, "tvm_version": "0.8.dev0"}
{"input": ["cuda -keys=cuda,gpu -max_num_threads=1024 -model=unknown -thread_warp_size=32", "conv2d_nchw_winograd.cuda", [["TENSOR", [1, 512, 32, 32], "float32"], ["TENSOR", [512, 512, 3, 3], "float32"], [1, 1], [1, 1, 1, 1], [1, 1], "float32"], {}], "config": {"index": 679266, "code_hash": null, "entity": [["tile_b", "sp", [-1, 1, 1, 1]], ["tile_y", "sp", [-1, 1, 16, 4]], ["tile_x", "sp", [-1, 1, 16, 4]], ["tile_rc", "sp", [-1, 64]], ["auto_unroll_max_step", "ot", 0], ["unroll_explicit", "ot", 1]]}, "result": [[0.00010664594949047407], 0, 3.310476541519165, 1623675932.1271427], "version": 0.2, "tvm_version": "0.8.dev0"}
{"input": ["cuda -keys=cuda,gpu -max_num_threads=1024 -model=unknown -thread_warp_size=32", "conv2d_nchw.cuda", [["TENSOR", [1, 512, 32, 32], "float32"], ["TENSOR", [512, 512, 3, 3], "float32"], [1, 1], [1, 1, 1, 1], [1, 1], "float32"], {}], "config": {"index": 161310414, "code_hash": null, "entity": [["tile_f", "sp", [-1, 1, 16, 1]], ["tile_y", "sp", [-1, 1, 1, 2]], ["tile_x", "sp", [-1, 1, 8, 4]], ["tile_rc", "sp", [-1, 8]], ["tile_ry", "sp", [-1, 3]], ["tile_rx", "sp", [-1, 3]], ["auto_unroll_max_step", "ot", 1500], ["unroll_explicit", "ot", 1]]}, "result": [[0.0003888635547073791], 0, 2.0519046783447266, 1623676408.0441027], "version": 0.2, "tvm_version": "0.8.dev0"}
{"input": ["cuda -keys=cuda,gpu -max_num_threads=1024 -model=unknown -thread_warp_size=32", "conv2d_nchw_winograd.cuda", [["TENSOR", [1, 512, 16, 16], "float32"], ["TENSOR", [512, 512, 3, 3], "float32"], [1, 1], [1, 1, 1, 1], [1, 1], "float32"], {}], "config": {"index": 213306, "code_hash": null, "entity": [["tile_b", "sp", [-1, 1, 1, 1]], ["tile_y", "sp", [-1, 1, 16, 4]], ["tile_x", "sp", [-1, 1, 8, 2]], ["tile_rc", "sp", [-1, 128]], ["auto_unroll_max_step", "ot", 1500], ["unroll_explicit", "ot", 0]]}, "result": [[5.400846831314073e-05], 0, 3.762005090713501, 1623677799.016169], "version": 0.2, "tvm_version": "0.8.dev0"}
{"input": ["cuda -keys=cuda,gpu -max_num_threads=1024 -model=unknown -thread_warp_size=32", "conv2d_nchw.cuda", [["TENSOR", [1, 512, 16, 16], "float32"], ["TENSOR", [512, 512, 3, 3], "float32"], [1, 1], [1, 1, 1, 1], [1, 1], "float32"], {}], "config": {"index": 52187114, "code_hash": null, "entity": [["tile_f", "sp", [-1, 1, 16, 1]], ["tile_y", "sp", [-1, 1, 2, 2]], ["tile_x", "sp", [-1, 1, 4, 2]], ["tile_rc", "sp", [-1, 8]], ["tile_ry", "sp", [-1, 3]], ["tile_rx", "sp", [-1, 3]], ["auto_unroll_max_step", "ot", 512], ["unroll_explicit", "ot", 1]]}, "result": [[0.00015604371096774192], 0, 2.173356771469116, 1623678953.8812003], "version": 0.2, "tvm_version": "0.8.dev0"}
{"input": ["cuda -keys=cuda,gpu -max_num_threads=1024 -model=unknown -thread_warp_size=32", "conv2d_nchw_winograd.cuda", [["TENSOR", [1, 1024, 32, 32], "float32"], ["TENSOR", [256, 1024, 3, 3], "float32"], [1, 1], [1, 1, 1, 1], [1, 1], "float32"], {}], "config": {"index": 703494, "code_hash": null, "entity": [["tile_b", "sp", [-1, 1, 1, 1]], ["tile_y", "sp", [-1, 1, 8, 4]], ["tile_x", "sp", [-1, 1, 16, 4]], ["tile_rc", "sp", [-1, 64]], ["auto_unroll_max_step", "ot", 128], ["unroll_explicit", "ot", 1]]}, "result": [[0.00011628721456123433], 0, 3.7811620235443115, 1623679596.9091656], "version": 0.2, "tvm_version": "0.8.dev0"}
{"input": ["cuda -keys=cuda,gpu -max_num_threads=1024 -model=unknown -thread_warp_size=32", "conv2d_nchw.cuda", [["TENSOR", [1, 1024, 32, 32], "float32"], ["TENSOR", [256, 1024, 3, 3], "float32"], [1, 1], [1, 1, 1, 1], [1, 1], "float32"], {}], "config": {"index": 132789255, "code_hash": null, "entity": [["tile_f", "sp", [-1, 1, 4, 2]], ["tile_y", "sp", [-1, 2, 2, 1]], ["tile_x", "sp", [-1, 1, 16, 2]], ["tile_rc", "sp", [-1, 8]], ["tile_ry", "sp", [-1, 3]], ["tile_rx", "sp", [-1, 3]], ["auto_unroll_max_step", "ot", 1500], ["unroll_explicit", "ot", 1]]}, "result": [[0.00048409245090180357], 0, 2.6986098289489746, 1623680699.4871206], "version": 0.2, "tvm_version": "0.8.dev0"}
{"input": ["cuda -keys=cuda,gpu -max_num_threads=1024 -model=unknown -thread_warp_size=32", "conv2d_nchw_winograd.cuda", [["TENSOR", [1, 256, 32, 32], "float32"], ["TENSOR", [256, 256, 3, 3], "float32"], [1, 1], [1, 1, 1, 1], [1, 1], "float32"], {}], "config": {"index": 592614, "code_hash": null, "entity": [["tile_b", "sp", [-1, 1, 1, 1]], ["tile_y", "sp", [-1, 1, 8, 4]], ["tile_x", "sp", [-1, 1, 16, 4]], ["tile_rc", "sp", [-1, 64]], ["auto_unroll_max_step", "ot", 128], ["unroll_explicit", "ot", 1]]}, "result": [[3.667914550751303e-05], 0, 4.292019605636597, 1623681848.461906], "version": 0.2, "tvm_version": "0.8.dev0"}
{"input": ["cuda -keys=cuda,gpu -max_num_threads=1024 -model=unknown -thread_warp_size=32", "conv2d_nchw.cuda", [["TENSOR", [1, 256, 32, 32], "float32"], ["TENSOR", [256, 256, 3, 3], "float32"], [1, 1], [1, 1, 1, 1], [1, 1], "float32"], {}], "config": {"index": 108987015, "code_hash": null, "entity": [["tile_f", "sp", [-1, 1, 4, 2]], ["tile_y", "sp", [-1, 2, 2, 1]], ["tile_x", "sp", [-1, 1, 16, 2]], ["tile_rc", "sp", [-1, 8]], ["tile_ry", "sp", [-1, 3]], ["tile_rx", "sp", [-1, 3]], ["auto_unroll_max_step", "ot", 1500], ["unroll_explicit", "ot", 1]]}, "result": [[0.0001244216678700361], 0, 2.5741660594940186, 1623682724.7686715], "version": 0.2, "tvm_version": "0.8.dev0"}
{"input": ["cuda -keys=cuda,gpu -max_num_threads=1024 -model=unknown -thread_warp_size=32", "conv2d_nchw_winograd.cuda", [["TENSOR", [1, 512, 64, 64], "float32"], ["TENSOR", [128, 512, 3, 3], "float32"], [1, 1], [1, 1, 1, 1], [1, 1], "float32"], {}], "config": {"index": 111442, "code_hash": null, "entity": [["tile_b", "sp", [-1, 1, 1, 1]], ["tile_y", "sp", [-1, 1, 16, 4]], ["tile_x", "sp", [-1, 1, 16, 4]], ["tile_rc", "sp", [-1, 32]], ["auto_unroll_max_step", "ot", 0], ["unroll_explicit", "ot", 0]]}, "result": [[0.00011728037542496357], 0, 3.9331555366516113, 1623683629.2655072], "version": 0.2, "tvm_version": "0.8.dev0"}
{"input": ["cuda -keys=cuda,gpu -max_num_threads=1024 -model=unknown -thread_warp_size=32", "conv2d_nchw.cuda", [["TENSOR", [1, 512, 64, 64], "float32"], ["TENSOR", [128, 512, 3, 3], "float32"], [1, 1], [1, 1, 1, 1], [1, 1], "float32"], {}], "config": {"index": 197719466, "code_hash": null, "entity": [["tile_f", "sp", [-1, 1, 16, 1]], ["tile_y", "sp", [-1, 4, 1, 1]], ["tile_x", "sp", [-1, 1, 8, 2]], ["tile_rc", "sp", [-1, 8]], ["tile_ry", "sp", [-1, 3]], ["tile_rx", "sp", [-1, 3]], ["auto_unroll_max_step", "ot", 1500], ["unroll_explicit", "ot", 1]]}, "result": [[0.0003949547984496124], 0, 2.2006170749664307, 1623684939.932641], "version": 0.2, "tvm_version": "0.8.dev0"}
{"input": ["cuda -keys=cuda,gpu -max_num_threads=1024 -model=unknown -thread_warp_size=32", "conv2d_nchw_winograd.cuda", [["TENSOR", [1, 128, 64, 64], "float32"], ["TENSOR", [128, 128, 3, 3], "float32"], [1, 1], [1, 1, 1, 1], [1, 1], "float32"], {}], "config": {"index": 269842, "code_hash": null, "entity": [["tile_b", "sp", [-1, 1, 1, 1]], ["tile_y", "sp", [-1, 1, 16, 4]], ["tile_x", "sp", [-1, 1, 16, 4]], ["tile_rc", "sp", [-1, 32]], ["auto_unroll_max_step", "ot", 128], ["unroll_explicit", "ot", 0]]}, "result": [[3.800066338520165e-05], 0, 3.625896692276001, 1623686967.7498186], "version": 0.2, "tvm_version": "0.8.dev0"}
{"input": ["cuda -keys=cuda,gpu -max_num_threads=1024 -model=unknown -thread_warp_size=32", "conv2d_nchw.cuda", [["TENSOR", [1, 128, 64, 64], "float32"], ["TENSOR", [128, 128, 3, 3], "float32"], [1, 1], [1, 1, 1, 1], [1, 1], "float32"], {}], "config": {"index": 158775986, "code_hash": null, "entity": [["tile_f", "sp", [-1, 1, 16, 1]], ["tile_y", "sp", [-1, 1, 1, 4]], ["tile_x", "sp", [-1, 1, 8, 2]], ["tile_rc", "sp", [-1, 8]], ["tile_ry", "sp", [-1, 3]], ["tile_rx", "sp", [-1, 3]], ["auto_unroll_max_step", "ot", 1500], ["unroll_explicit", "ot", 1]]}, "result": [[0.00010203666778298727], 0, 2.0750203132629395, 1623687887.3639858], "version": 0.2, "tvm_version": "0.8.dev0"}
{"input": ["cuda -keys=cuda,gpu -max_num_threads=1024 -model=unknown -thread_warp_size=32", "conv2d_nchw_winograd.cuda", [["TENSOR", [1, 256, 128, 128], "float32"], ["TENSOR", [64, 256, 3, 3], "float32"], [1, 1], [1, 1, 1, 1], [1, 1], "float32"], {}], "config": {"index": 997227, "code_hash": null, "entity": [["tile_b", "sp", [-1, 1, 1, 1]], ["tile_y", "sp", [-1, 1, 16, 4]], ["tile_x", "sp", [-1, 1, 8, 4]], ["tile_rc", "sp", [-1, 32]], ["auto_unroll_max_step", "ot", 128], ["unroll_explicit", "ot", 1]]}, "result": [[0.00013997811828935395], 0, 3.869580030441284, 1623689279.9173393], "version": 0.2, "tvm_version": "0.8.dev0"}
{"input": ["cuda -keys=cuda,gpu -max_num_threads=1024 -model=unknown -thread_warp_size=32", "conv2d_nchw.cuda", [["TENSOR", [1, 256, 128, 128], "float32"], ["TENSOR", [64, 256, 3, 3], "float32"], [1, 1], [1, 1, 1, 1], [1, 1], "float32"], {}], "config": {"index": 254603791, "code_hash": null, "entity": [["tile_f", "sp", [-1, 1, 8, 2]], ["tile_y", "sp", [-1, 2, 1, 2]], ["tile_x", "sp", [-1, 1, 16, 2]], ["tile_rc", "sp", [-1, 8]], ["tile_ry", "sp", [-1, 3]], ["tile_rx", "sp", [-1, 3]], ["auto_unroll_max_step", "ot", 1500], ["unroll_explicit", "ot", 1]]}, "result": [[0.00034023366369710466], 0, 3.2630198001861572, 1623690165.1857812], "version": 0.2, "tvm_version": "0.8.dev0"}
{"input": ["cuda -keys=cuda,gpu -max_num_threads=1024 -model=unknown -thread_warp_size=32", "conv2d_nchw_winograd.cuda", [["TENSOR", [1, 64, 128, 128], "float32"], ["TENSOR", [64, 64, 3, 3], "float32"], [1, 1], [1, 1, 1, 1], [1, 1], "float32"], {}], "config": {"index": 460901, "code_hash": null, "entity": [["tile_b", "sp", [-1, 1, 1, 1]], ["tile_y", "sp", [-1, 1, 2, 16]], ["tile_x", "sp", [-1, 2, 64, 1]], ["tile_rc", "sp", [-1, 32]], ["auto_unroll_max_step", "ot", 1500], ["unroll_explicit", "ot", 0]]}, "result": [[4.5804802035330264e-05], 0, 3.829265594482422, 1623692031.3806822], "version": 0.2, "tvm_version": "0.8.dev0"}
{"input": ["cuda -keys=cuda,gpu -max_num_threads=1024 -model=unknown -thread_warp_size=32", "conv2d_nchw.cuda", [["TENSOR", [1, 64, 128, 128], "float32"], ["TENSOR", [64, 64, 3, 3], "float32"], [1, 1], [1, 1, 1, 1], [1, 1], "float32"], {}], "config": {"index": 198962167, "code_hash": null, "entity": [["tile_f", "sp", [-1, 2, 8, 1]], ["tile_y", "sp", [-1, 2, 1, 2]], ["tile_x", "sp", [-1, 1, 16, 2]], ["tile_rc", "sp", [-1, 8]], ["tile_ry", "sp", [-1, 3]], ["tile_rx", "sp", [-1, 3]], ["auto_unroll_max_step", "ot", 1500], ["unroll_explicit", "ot", 1]]}, "result": [[8.842920363636363e-05], 0, 3.4214000701904297, 1623692449.9315922], "version": 0.2, "tvm_version": "0.8.dev0"}
{"input": ["cuda -keys=cuda,gpu -max_num_threads=1024 -model=unknown -thread_warp_size=32", "conv2d_nchw_winograd.cuda", [["TENSOR", [1, 128, 256, 256], "float32"], ["TENSOR", [64, 128, 3, 3], "float32"], [1, 1], [1, 1, 1, 1], [1, 1], "float32"], {}], "config": {"index": 775729, "code_hash": null, "entity": [["tile_b", "sp", [-1, 1, 1, 1]], ["tile_y", "sp", [-1, 1, 8, 8]], ["tile_x", "sp", [-1, 2, 16, 2]], ["tile_rc", "sp", [-1, 16]], ["auto_unroll_max_step", "ot", 1500], ["unroll_explicit", "ot", 0]]}, "result": [[0.00028814113257575756], 0, 3.107896089553833, 1623693506.9007645], "version": 0.2, "tvm_version": "0.8.dev0"}
{"input": ["cuda -keys=cuda,gpu -max_num_threads=1024 -model=unknown -thread_warp_size=32", "conv2d_nchw.cuda", [["TENSOR", [1, 128, 256, 256], "float32"], ["TENSOR", [64, 128, 3, 3], "float32"], [1, 1], [1, 1, 1, 1], [1, 1], "float32"], {}], "config": {"index": 426794823, "code_hash": null, "entity": [["tile_f", "sp", [-1, 1, 16, 4]], ["tile_y", "sp", [-1, 1, 1, 2]], ["tile_x", "sp", [-1, 1, 16, 4]], ["tile_rc", "sp", [-1, 4]], ["tile_ry", "sp", [-1, 3]], ["tile_rx", "sp", [-1, 3]], ["auto_unroll_max_step", "ot", 1500], ["unroll_explicit", "ot", 1]]}, "result": [[0.000623039658436214], 0, 2.907604455947876, 1623694791.1834414], "version": 0.2, "tvm_version": "0.8.dev0"}
{"input": ["cuda -keys=cuda,gpu -max_num_threads=1024 -model=unknown -thread_warp_size=32", "conv2d_nchw_winograd.cuda", [["TENSOR", [1, 64, 256, 256], "float32"], ["TENSOR", [64, 64, 3, 3], "float32"], [1, 1], [1, 1, 1, 1], [1, 1], "float32"], {}], "config": {"index": 1234963, "code_hash": null, "entity": [["tile_b", "sp", [-1, 1, 1, 1]], ["tile_y", "sp", [-1, 1, 4, 16]], ["tile_x", "sp", [-1, 1, 32, 2]], ["tile_rc", "sp", [-1, 16]], ["auto_unroll_max_step", "ot", 128], ["unroll_explicit", "ot", 1]]}, "result": [[0.00017158706174591907], 0, 3.7051661014556885, 1623695376.7224362], "version": 0.2, "tvm_version": "0.8.dev0"}
{"input": ["cuda -keys=cuda,gpu -max_num_threads=1024 -model=unknown -thread_warp_size=32", "conv2d_nchw.cuda", [["TENSOR", [1, 64, 256, 256], "float32"], ["TENSOR", [64, 64, 3, 3], "float32"], [1, 1], [1, 1, 1, 1], [1, 1], "float32"], {}], "config": {"index": 374154526, "code_hash": null, "entity": [["tile_f", "sp", [-1, 1, 16, 2]], ["tile_y", "sp", [-1, 1, 1, 2]], ["tile_x", "sp", [-1, 2, 8, 4]], ["tile_rc", "sp", [-1, 4]], ["tile_ry", "sp", [-1, 3]], ["tile_rx", "sp", [-1, 3]], ["auto_unroll_max_step", "ot", 1500], ["unroll_explicit", "ot", 1]]}, "result": [[0.000318928979338843], 0, 2.8151228427886963, 1623696129.1750276], "version": 0.2, "tvm_version": "0.8.dev0"}
{"input": ["cuda -keys=cuda,gpu -max_num_threads=1024 -model=unknown -thread_warp_size=32", "conv2d_nchw.cuda", [["TENSOR", [1, 64, 256, 256], "float32"], ["TENSOR", [1, 64, 1, 1], "float32"], [1, 1], [0, 0, 0, 0], [1, 1], "float32"], {}], "config": {"index": 605394, "code_hash": null, "entity": [["tile_f", "sp", [-1, 1, 1, 1]], ["tile_y", "sp", [-1, 1, 2, 1]], ["tile_x", "sp", [-1, 1, 64, 1]], ["tile_rc", "sp", [-1, 2]], ["tile_ry", "sp", [-1, 1]], ["tile_rx", "sp", [-1, 1]], ["auto_unroll_max_step", "ot", 0], ["unroll_explicit", "ot", 1]]}, "result": [[9.768238138022504e-06], 0, 1.696246862411499, 1623697059.6827984], "version": 0.2, "tvm_version": "0.8.dev0"}
